exp_id	residual	solution_norm	solution_mean	status	description	agent	design	elapsed_s	solution_energy
exp376	4.06182911e-18	0.000000	-0.000000	discard	4-mode basin offset=0.1	agent1	initial_cond	0	-0.000000
exp377	1.60399903e-20	0.000000	-0.000000	discard	4-mode basin offset=0.2	agent1	initial_cond	0	-0.000000
exp378	1.66462880e-24	0.000000	0.000000	discard	4-mode basin offset=0.3	agent1	initial_cond	1	0.000000
exp379	5.45453979e-19	0.000000	-0.000000	discard	4-mode basin offset=0.4	agent1	initial_cond	0	-0.000000
exp380	1.23633098e-15	1.001296	-1.000019	discard	4-mode basin offset=0.5	agent1	initial_cond	0	-1.520844
exp381	7.25637132e-16	1.001296	1.000019	discard	4-mode basin offset=0.6	agent1	initial_cond	0	-1.520844
exp382	2.06774381e-16	1.001296	1.000019	discard	4-mode basin offset=0.7	agent1	initial_cond	0	-1.520844
exp383	3.06884301e-16	1.001296	1.000019	discard	4-mode basin offset=0.8	agent1	initial_cond	0	-1.520844
exp384	1.86448479e-16	1.001296	1.000019	discard	4-mode basin offset=0.9	agent1	initial_cond	0	-1.520844
exp385	2.06774381e-16	1.001296	1.000019	discard	4-mode basin offset=1.0	agent1	initial_cond	1	-1.520844
exp386	5.55111512e-17	1.001322	1.000049	discard	triple junction u_offset=0.4498	agent2	initial_cond	0	-1.520921
exp387	5.45453979e-19	0.000000	-0.000000	discard	4-mode basin refine offset=0.40	agent1	initial_cond	1	-0.000000
exp388	8.06938013e-27	0.000000	0.000000	discard	4-mode basin refine offset=0.42	agent1	initial_cond	0	0.000000
exp389	2.47250685e-28	0.000000	0.000000	discard	4-mode basin refine offset=0.44	agent1	initial_cond	0	0.000000
exp390	2.73184526e-16	1.001296	1.000019	discard	4-mode basin refine offset=0.46	agent1	initial_cond	0	-1.520844
exp391	1.88564362e-15	1.001296	1.000019	discard	4-mode basin refine offset=0.48	agent1	initial_cond	1	-1.520844
exp392	1.23633098e-15	1.001296	-1.000019	discard	4-mode basin refine offset=0.50	agent1	initial_cond	0	-1.520844
exp393	1.96261557e-16	1.001296	-1.000019	discard	4-mode basin refine offset=0.52	agent1	initial_cond	0	-1.520844
exp394	3.85733855e-15	1.001296	-1.000019	discard	4-mode basin refine offset=0.54	agent1	initial_cond	0	-1.520844
exp395	3.62021453e-16	1.001296	-1.000019	discard	4-mode basin refine offset=0.56	agent1	initial_cond	1	-1.520844
exp396	3.62021453e-16	1.001296	1.000019	discard	4-mode basin refine offset=0.58	agent1	initial_cond	0	-1.520844
exp397	7.25637132e-16	1.001296	1.000019	discard	4-mode basin refine offset=0.60	agent1	initial_cond	0	-1.520844
