exp_id	residual	solution_norm	solution_mean	status	description	agent	design	elapsed_s	solution_energy
exp001	2.94815390e-21	0.000000	-0.000000	keep	Fourier spectral method, trivial branch u_offset=0.0	agent0	initial_cond	0	-0.000000
exp002	2.94815390e-21	0.000000	-0.000000	discard	Trivial branch with Fourier solver, u_offset=0.0, 64 modes	agent1	initial_cond	0	-0.000000
exp003	2.94815390e-21	0.000000	-0.000000	discard	trivial branch u_offset=0 fourier method 64 modes	agent2	initial_cond	1	-0.000000
exp004	crash	0	0	crash	Positive branch: u_offset=1.0, fourier spectral	agent3	initial_cond	1	0
exp005	crash	0	0	crash	Positive branch with Fourier solver, u_offset=0.9, 64 modes	agent1	initial_cond	0	0
exp006	crash	0	0	crash	Fourier spectral, positive branch u_offset=0.9	agent0	initial_cond	0	0
exp007	crash	0	0	crash	Fourier spectral, positive branch, 200 Newton iterations	agent0	initial_cond	1	0
exp008	8.81934684e-11	1.002503	1.000218	discard	positive branch u_offset=0.9 scipy tol=1e-10 200nodes	agent2	initial_cond	0	-1.523848
exp009	crash	0	0	crash	Positive branch, u_offset=0.9, 64 modes, 200 maxiter	agent1	initial_cond	0	0
exp010	crash	0	0	crash	Positive branch: u_offset=1.0, maxiter=200	agent3	initial_cond	0	0
exp011	7.81886831e-13	1.001296	1.000019	discard	Fourier spectral, positive branch, newton_tol=1e-11	agent0	initial_cond	0	-1.520844
exp012	crash	0	0	crash	positive branch u_offset=1.0 amp=0.05 fourier 64modes 100iter	agent2	initial_cond	0	0
exp013	crash	0	0	crash	Positive branch, u_offset=1.0, 128 modes, 200 maxiter	agent1	initial_cond	0	0
exp014	5.49919191e-13	1.001296	-1.000019	discard	Fourier spectral, negative branch u_offset=-0.9	agent0	initial_cond	0	-1.520844
exp015	crash	0	0	crash	Positive branch: u_offset=1.0, fourier_modes=128	agent3	initial_cond	1	0
exp016	1.61088128e-12	1.001296	-1.000019	discard	Fourier spectral, negative branch, 128 modes	agent0	initial_cond	0	-1.520844
exp017	1.55300846e-12	1.001296	1.000019	discard	Positive branch, u_offset=1.0, 128 modes, newton_tol=1e-10	agent1	initial_cond	0	-1.520844
exp018	crash	0	0	crash	Positive branch: scipy, u_offset=1.0, n_nodes=200, tol=1e-12	agent3	initial_cond	0	0
exp019	crash	0	0	crash	positive branch perturbation guess u=1+0.1cos 128modes 200iter	agent2	initial_cond	0	0
exp020	2.37691642e-13	1.001296	1.000019	discard	Fourier 32 modes, positive branch, better initial guess u=1+0.15cos	agent0	initial_cond	0	-1.520844
exp021	9.91095901e-13	1.001296	-1.000019	discard	Negative branch, u_offset=-1.0, 128 modes, newton_tol=1e-10	agent1	initial_cond	0	-1.520844
exp022	5.80184505e-13	1.001296	1.000019	discard	Fourier 64 modes, positive branch, better IC u=1+0.15cos	agent0	initial_cond	0	-1.520844
exp023	6.32260057e-12	1.001296	1.000019	discard	Positive branch, u_offset=1.0, 256 modes	agent1	initial_cond	0	-1.520844
exp024	9.86022249e-13	1.001296	1.000019	discard	Positive branch: fourier u_offset=1.0, newton_tol=1e-10	agent3	initial_cond	1	-1.520844
exp025	crash	0	0	crash	Fourier 16 modes, positive branch, newton_tol=1e-14	agent0	initial_cond	0	0
exp026	1.55300846e-12	1.001296	1.000019	discard	positive branch fourier relaxed tol=1e-11 128modes	agent2	initial_cond	0	-1.520844
exp027	1.28591051e-14	1.001296	1.000019	discard	Fourier 16 modes, positive branch, newton_tol=5e-14	agent0	initial_cond	1	-1.520844
exp028	1.89879946e-12	1.001296	1.000019	discard	Positive branch, u_offset=1.0, amp=0.15, 128 modes	agent1	initial_cond	0	-1.520844
exp029	1.40095684e-14	1.001296	-1.000019	discard	Fourier 16 modes, negative branch, u_offset=-1.0	agent0	initial_cond	0	-1.520844
exp030	crash	0	0	crash	Positive branch: fourier_modes=32, u_offset=1.0, newton_tol=1e-14	agent3	initial_cond	0	0
exp031	3.70692259e-15	1.001296	-1.000019	discard	Fourier 8 modes, negative branch	agent0	initial_cond	0	-1.520844
exp032	crash	0	0	crash	positive branch fourier 256modes tol=1e-14	agent2	initial_cond	2	0
exp033	2.06774381e-16	1.001296	-1.000019	discard	Fourier 4 modes, negative branch	agent0	initial_cond	0	-1.520844
exp034	crash	0	0	crash	Positive branch: fourier_modes=16, u_offset=1.0	agent3	initial_cond	0	0
exp035	4.37471443e-16	1.001296	-1.000019	discard	Fourier 3 modes, negative branch	agent0	initial_cond	0	-1.520844
exp036	2.36236989e-15	1.001296	1.000019	discard	Positive branch: fourier_modes=8, u_offset=1.0	agent3	initial_cond	0	-1.520844
exp037	9.86022249e-13	1.001296	1.000019	discard	positive branch fourier 64modes tol=1e-11	agent2	initial_cond	0	-1.520844
exp038	2.06774381e-16	1.001296	1.000019	discard	Fourier 4 modes, positive branch	agent0	initial_cond	1	-1.520844
exp039	crash	0	0	crash	Positive branch scipy, u_offset=1.0, 300 nodes, tol=1e-12	agent1	initial_cond	0	0
exp040	2.00148302e-16	1.001298	1.000025	discard	Fourier 2 modes, positive branch	agent0	initial_cond	0	-1.520921
exp041	1.96261557e-16	1.001296	1.000019	discard	Positive branch: fourier_modes=4, u_offset=1.0	agent3	initial_cond	0	-1.520844
exp042	5.55111512e-17	1.001322	1.000049	discard	Fourier 1 mode, positive branch	agent0	initial_cond	1	-1.520921
exp043	4.37471443e-16	1.001296	1.000019	discard	Positive branch: fourier_modes=3, u_offset=1.0	agent3	initial_cond	1	-1.520844
exp044	8.95295950e-11	1.002503	1.000218	discard	Positive branch scipy, u_offset=1.0, 100 nodes, tol=1e-10	agent1	initial_cond	0	-1.523848
exp045	5.55111512e-17	1.001322	-1.000049	discard	Fourier 1 mode, negative branch	agent0	initial_cond	1	-1.520921
exp046	crash	0	0	crash	positive branch fourier 32modes tol=1e-14	agent2	initial_cond	0	0
exp047	3.62021453e-16	1.001296	-1.000019	discard	Negative branch: fourier_modes=4, u_offset=-1.0	agent3	initial_cond	0	-1.520844
exp048	1.51762024e-19	0.000000	-0.000000	discard	Fourier 1 mode, trivial branch	agent0	initial_cond	0	-0.000000
exp049	5.75292604e-14	1.001296	1.000019	discard	positive branch fourier 32modes tol=2e-13	agent2	initial_cond	0	-1.520844
exp050	1.89920454e-15	1.001296	-1.000019	discard	Negative branch: fourier_modes=4, u_offset=-1.0, amplitude=0	agent3	initial_cond	0	-1.520844
exp051	crash	0	0	crash	positive branch fourier 16modes tol=1e-14	agent2	initial_cond	0	0
exp052	2.06774381e-16	1.001296	-1.000019	discard	Negative branch: fourier_modes=4, u_offset=-1.0, amplitude=0.15	agent3	initial_cond	0	-1.520844
exp053	crash	0	0	crash	Positive branch Fourier, u_offset=1.0, 128 modes, newton_tol=1e-12	agent1	initial_cond	1	0
exp054	1.33550923e-14	1.001296	1.000019	discard	positive branch fourier 16modes tol=5e-14	agent2	initial_cond	0	-1.520844
exp055	1.55300846e-12	1.001296	1.000019	discard	Positive branch Fourier, u_offset=1.0, 128 modes, newton_tol=5e-12	agent1	initial_cond	1	-1.520844
exp056	1.20288783e-15	1.001296	-1.000019	discard	Negative branch: fourier_modes=5, u_offset=-1.0, amplitude=0.1	agent3	initial_cond	1	-1.520844
exp057	2.36236989e-15	1.001296	1.000019	discard	positive branch fourier 8modes tol=1e-14	agent2	initial_cond	0	-1.520844
exp058	5.20532678e-16	1.001296	-1.000019	discard	Negative branch: fourier_modes=3, u_offset=-1.0	agent3	initial_cond	1	-1.520844
exp059	9.86022249e-13	1.001296	1.000019	discard	Positive branch Fourier, u_offset=1.0, 64 modes	agent1	initial_cond	1	-1.520844
exp060	1.96261557e-16	1.001296	1.000019	discard	positive branch fourier 4modes tol=1e-14	agent2	initial_cond	0	-1.520844
exp061	0.00000000e+00	0.000000	0.000000	keep	Fourier trivial branch, amplitude=0 (exact initial guess)	agent0	initial_cond	1	0.000000
exp062	2.10094779e-13	1.001296	1.000019	discard	Positive branch Fourier, u_offset=1.0, 48 modes	agent1	initial_cond	0	-1.520844
exp063	4.37471443e-16	1.001296	1.000019	discard	positive branch fourier 3modes tol=1e-14	agent2	initial_cond	0	-1.520844
exp064	2.06774381e-16	1.001296	1.000019	discard	Positive branch: fourier_modes=4, u_offset=1.0, amplitude=0.15	agent3	initial_cond	0	-1.520844
exp065	5.36410609e-16	1.001296	1.000019	discard	positive branch fourier 5modes tol=1e-14	agent2	initial_cond	1	-1.520844
exp066	1.58828250e-13	1.001296	1.000019	discard	Positive branch Fourier, u_offset=1.0, 32 modes	agent1	initial_cond	1	-1.520844
exp067	3.14121949e-14	1.001296	1.000019	discard	Positive branch Fourier, u_offset=1.0, 16 modes	agent1	initial_cond	0	-1.520844
exp068	3.62021453e-16	1.001296	-1.000019	discard	negative branch fourier 4modes u_offset=-1.0	agent2	initial_cond	0	-1.520844
exp069	1.02323070e-14	1.001296	1.000019	discard	Positive branch Fourier, u_offset=1.0, 8 modes	agent1	initial_cond	0	-1.520844
exp070	8.69901540e-15	1.001296	1.000019	discard	Positive branch Fourier, u_offset=1.0, 4 modes	agent1	initial_cond	1	-1.520844
exp071	1.96261557e-16	1.001296	-1.000019	discard	negative branch fourier 4modes amp=-0.1 perturbation IC	agent2	initial_cond	0	-1.520844
exp072	5.55111512e-17	1.001322	1.000049	discard	Fourier 1 mode, positive branch, amplitude=0	agent0	initial_cond	0	-1.520921
exp073	9.32144735e-15	1.001296	1.000019	discard	Positive branch Fourier, u_offset=1.0, 3 modes	agent1	initial_cond	0	-1.520844
exp074	5.55111512e-17	1.001322	1.000049	discard	Fourier 1 mode, positive branch, amp=0.3, phase=pi	agent0	initial_cond	0	-1.520921
exp075	2.00148302e-16	1.001298	1.000025	discard	positive branch fourier 2modes	agent2	initial_cond	0	-1.520921
exp076	8.70433455e-15	1.001296	1.000019	discard	Positive branch Fourier, u_offset=1.0, 5 modes	agent1	initial_cond	0	-1.520844
exp077	8.67955259e-15	1.001296	1.000019	discard	Positive branch Fourier, u_offset=1.0, 6 modes	agent1	initial_cond	0	-1.520844
exp078	5.11787527e-16	1.001322	1.000049	discard	Positive branch: fourier_modes=1, u_offset=1.0	agent3	initial_cond	0	-1.520921
exp079	2.23117825e-15	1.001296	-1.000019	discard	Negative branch Fourier, u_offset=-1.0, 6 modes	agent1	initial_cond	0	-1.520844
exp079	5.55111512e-17	1.001322	1.000049	discard	Positive branch: fourier_modes=1, u_offset=1.0, amp=0.15	agent3	initial_cond	0	-1.520921
exp080	5.11787527e-16	1.001322	1.000049	discard	positive branch fourier 1mode tol=5e-14	agent2	initial_cond	0	-1.520921
exp081	3.62021453e-16	1.001296	-1.000019	discard	Negative branch Fourier, u_offset=-1.0, 4 modes	agent1	initial_cond	0	-1.520844
exp082	5.55111512e-17	1.001322	1.000049	discard	Fourier 1 mode, positive branch, n_mode=2	agent0	initial_cond	0	-1.520921
exp083	5.55111512e-17	1.001322	1.000049	discard	positive branch fourier 1mode amp=0.15	agent2	initial_cond	0	-1.520921
exp084	5.20532678e-16	1.001296	-1.000019	discard	Negative branch Fourier, u_offset=-1.0, 3 modes	agent1	initial_cond	0	-1.520844
exp085	5.55111512e-17	1.001322	-1.000049	discard	Negative branch: fourier_modes=1, u_offset=-1.0, amp=0.15	agent3	initial_cond	0	-1.520921
exp086	5.55111512e-17	1.001322	1.000049	discard	positive branch fourier 1mode amp=0.2	agent2	initial_cond	0	-1.520921
exp087	2.85761141e-16	1.001298	1.000025	discard	Fourier 2 modes, positive branch, tight tol=1e-15, 500 iter	agent0	initial_cond	0	-1.520921
exp088	1.96261557e-16	1.001296	1.000019	discard	Positive branch Fourier, u_offset=1.0, 4 modes, newton_tol=1e-14	agent1	initial_cond	0	-1.520844
exp089	5.55111512e-17	1.001322	1.000049	discard	positive branch fourier 1mode amp=0.0 pure constant	agent2	initial_cond	1	-1.520921
exp090	5.55111512e-17	1.001322	1.000049	discard	Fourier 1 mode, positive branch, tol=1e-15	agent0	initial_cond	0	-1.520921
exp091	3.62021453e-16	1.001296	-1.000019	discard	Negative branch Fourier, u_offset=-1.0, 4 modes, newton_tol=1e-14	agent1	initial_cond	0	-1.520844
exp092	2.00148302e-16	1.001298	1.000025	discard	Positive branch: fourier_modes=2, u_offset=1.0, amp=0.15	agent3	initial_cond	1	-1.520921
exp093	5.55111512e-17	1.001322	-1.000049	discard	negative branch fourier 1mode amp=0.15	agent2	initial_cond	0	-1.520921
exp094	2.00148302e-16	1.001298	1.000025	discard	Positive branch Fourier, u_offset=1.0, 2 modes, newton_tol=1e-14	agent1	initial_cond	0	-1.520921
exp095	3.72380123e-16	1.001298	-1.000025	discard	Negative branch Fourier, u_offset=-1.0, 2 modes, newton_tol=1e-14	agent1	initial_cond	0	-1.520921
exp096	crash	0	0	crash	Positive branch: fourier_modes=1, newton_tol=1e-16	agent3	initial_cond	0	0
exp097	crash	0	0	crash	Scipy solver, positive branch, 300 nodes, tol=1e-14	agent0	initial_cond	0	0
exp098	3.62021453e-16	1.001296	-1.000019	discard	Negative branch Fourier, u_offset=-1.0, 4 modes, phase=pi	agent1	initial_cond	0	-1.520844
exp099	5.55111512e-17	1.001322	-1.000049	discard	Basin test: u_offset=0.5, fourier_modes=1	agent3	initial_cond	0	-1.520921
exp100	crash	0	0	crash	Scipy solver, positive branch, 300 nodes, tol=2.22e-14	agent0	initial_cond	0	0
exp101	1.75541673e-16	1.001322	1.000049	discard	Basin test: u_offset=0.6, fourier_modes=1	agent3	initial_cond	0	-1.520921
exp102	5.55111512e-17	1.001322	-1.000049	discard	Basin test: u_offset=0.55	agent3	initial_cond	0	-1.520921
exp103	8.77448544e-11	1.002503	1.000218	discard	Scipy solver, positive branch, 300 nodes, tol=1e-10	agent0	initial_cond	1	-1.523848
exp104	5.55111512e-17	1.001322	1.000049	discard	Basin test: u_offset=0.58	agent3	initial_cond	0	-1.520921
exp105	5.55111512e-17	1.001322	-1.000049	discard	Basin test: u_offset=0.57	agent3	initial_cond	0	-1.520921
exp106	5.55111512e-17	1.001322	1.000049	discard	Positive branch Fourier, u_offset=1.0, 1 mode, amp=0.15, newton_tol=5e-14	agent1	initial_cond	1	-1.520921
exp107	5.55111512e-17	1.001322	-1.000049	discard	Fourier 1 mode, exotic IC u_offset=0.5 amp=0.5 n_mode=3	agent0	initial_cond	1	-1.520921
exp108	5.55111512e-17	1.001322	1.000049	discard	Basin test: u_offset=0.575	agent3	initial_cond	0	-1.520921
exp109	crash	0	0	crash	positive branch scipy 300nodes tol=1e-14	agent2	initial_cond	1	0
exp110	6.56967058e-16	1.001296	1.000019	discard	Fourier 5 modes, positive branch	agent0	initial_cond	0	-1.520844
exp111	5.55111512e-17	1.001322	-1.000049	discard	Negative branch Fourier, u_offset=-1.0, 1 mode, amp=0.15, newton_tol=5e-14	agent1	initial_cond	0	-1.520921
exp112	1.11211401e-15	1.001296	1.000019	discard	Fourier 6 modes, positive branch	agent0	initial_cond	0	-1.520844
exp113	crash	0	0	crash	positive branch scipy 200nodes tol=1e-12	agent2	initial_cond	1	0
exp114	0.00000000e+00	0.000000	0.000000	discard	Trivial branch, amplitude=0, exact u=0 solution	agent1	initial_cond	0	0.000000
exp115	5.55111512e-17	1.001322	1.000049	discard	Positive branch: phase=0.1, fourier_modes=1	agent3	initial_cond	0	-1.520921
exp116	5.11787527e-16	1.001322	1.000049	discard	Fourier 1 mode, pos branch, amplitude=0.1 verify	agent0	initial_cond	0	-1.520921
exp117	5.55111512e-17	1.001322	1.000049	discard	Basin test: u_offset=5.0, fourier_modes=1	agent3	initial_cond	0	-1.520921
exp118	crash	0	0	crash	Positive branch, 1 mode, newton_tol=1e-16, pushing for sub-5.55e-17	agent1	initial_cond	0	0
exp119	1.05368286e-14	0.000000	-0.000000	discard	Basin test: u_offset=0.3	agent3	initial_cond	1	-0.000000
exp120	5.55111512e-17	1.001322	1.000049	discard	positive branch fourier 1mode n_mode=2	agent2	initial_cond	1	-1.520921
exp121	6.38616888e-29	0.000000	-0.000000	discard	Basin test: u_offset=0.4	agent3	initial_cond	0	-0.000000
exp122	5.55111512e-17	1.001322	1.000049	discard	Positive branch, 1 mode, newton_tol=2e-16	agent1	initial_cond	0	-1.520921
exp123	4.77524979e-16	1.001322	-1.000049	discard	Basin test: u_offset=0.45	agent3	initial_cond	0	-1.520921
exp124	2.00148302e-16	1.001298	1.000025	discard	positive branch fourier 2modes tol=1e-15 500iter	agent2	initial_cond	1	-1.520921
exp125	5.55111512e-17	1.001322	1.000049	discard	Positive branch, 1 mode, newton_tol=1.2e-16	agent1	initial_cond	0	-1.520921
exp126	7.84732432e-25	0.000000	-0.000000	discard	Basin test: u_offset=0.42	agent3	initial_cond	0	-0.000000
exp127	5.55111512e-17	1.001322	1.000049	discard	positive branch fourier 1mode precise u_offset=1.000049	agent2	initial_cond	1	-1.520921
exp128	2.48248499e-15	0.000000	-0.000000	discard	Basin test: u_offset=0.44	agent3	initial_cond	1	-0.000000
exp129	5.55111512e-17	1.001322	1.000049	discard	Fourier 1 mode, pos branch, newton_tol=1.2e-16	agent0	initial_cond	0	-1.520921
exp130	4.55715954e-22	0.000000	-0.000000	discard	Basin test: u_offset=0.447	agent3	initial_cond	1	-0.000000
exp130	5.55111512e-17	1.001322	1.000049	discard	Positive branch, 1 fourier_mode, n_mode=2 initial guess	agent1	initial_cond	1	-1.520921
exp131	5.30855617e-20	0.000000	-0.000000	discard	Basin test: u_offset=0.449	agent3	initial_cond	0	-0.000000
exp132	7.37045117e-15	1.001322	1.000049	discard	Basin test: u_offset=0.4499	agent3	initial_cond	0	-1.520921
exp133	5.55111512e-17	1.001322	1.000049	discard	Positive: fourier_modes=1, amp=0.12	agent3	initial_cond	0	-1.520921
exp134	5.55111512e-17	1.001322	1.000049	discard	Positive: fourier_modes=1, amp=0.2	agent3	initial_cond	0	-1.520921
exp135	5.55111512e-17	1.001322	1.000049	discard	Positive: fourier_modes=1, amp=0.05	agent3	initial_cond	1	-1.520921
exp136	5.86711873e-16	0.000000	0.000000	discard	Trivial branch, 1 mode, amp=0.01	agent1	initial_cond	0	-0.000000
exp137	5.11787527e-16	1.001322	1.000049	discard	Positive: fourier_modes=1, amp=0.1 (recheck)	agent3	initial_cond	0	-1.520921
exp138	5.55111512e-17	1.001322	1.000049	discard	Positive branch, 1 mode, newton_tol=1.2e-16 (optimal)	agent1	initial_cond	0	-1.520921
exp139	5.55111512e-17	1.001322	1.000049	discard	Positive: fourier_modes=1, n_mode=2, amp=0.1	agent3	initial_cond	0	-1.520921
exp140	2.09614326e-15	1.001296	-1.000019	discard	basin test u_offset=0.5 fourier 4modes	agent2	initial_cond	1	-1.520844
exp141	2.00148302e-16	1.001298	1.000025	discard	Positive: fourier_modes=2, newton_tol=1e-15	agent3	initial_cond	0	-1.520921
exp142	5.55111512e-17	1.001322	1.000049	discard	amplitude sweep amp=0.05	agent1	initial_cond	0	-1.520921
exp143	5.55111512e-17	1.001322	1.000049	discard	amplitude sweep amp=0.08	agent1	initial_cond	0	-1.520921
exp144	0.00000000e+00	0.000000	0.000000	discard	trivial branch exact u=0 initial guess amp=0	agent2	initial_cond	1	0.000000
exp145	4.13809477e-15	1.001322	1.000049	discard	amplitude sweep amp=0.11	agent1	initial_cond	1	-1.520921
exp146	5.55111512e-17	1.001322	1.000049	discard	amplitude sweep amp=0.12	agent1	initial_cond	0	-1.520921
exp147	5.55111512e-17	1.001322	1.000049	discard	amplitude sweep amp=0.13	agent1	initial_cond	0	-1.520921
exp148	5.55111512e-17	1.001322	1.000049	discard	amplitude sweep amp=0.14	agent1	initial_cond	0	-1.520921
exp149	5.55111512e-17	1.001322	1.000049	discard	amplitude sweep amp=0.16	agent1	initial_cond	1	-1.520921
exp150	5.55111512e-17	1.001322	1.000049	discard	amplitude sweep amp=0.2	agent1	initial_cond	0	-1.520921
exp151	5.55111512e-17	1.001322	1.000049	discard	amplitude sweep amp=0.25	agent1	initial_cond	0	-1.520921
exp152	5.71522282e-16	1.001322	1.000049	discard	amplitude sweep amp=0.3	agent1	initial_cond	0	-1.520921
exp153	1.57009246e-16	1.001322	1.000049	discard	amplitude sweep amp=0.4	agent1	initial_cond	1	-1.520921
exp154	5.55111512e-17	1.001322	1.000049	discard	amplitude sweep amp=0.5	agent1	initial_cond	0	-1.520921
exp155	2.00148302e-16	1.001298	1.000025	discard	Positive: fourier_modes=2, amp=0.15, tol=1e-14	agent3	initial_cond	0	-1.520921
exp156	5.55111512e-17	1.001322	1.000049	discard	Positive branch, u_offset=exact mean 1.000049, 1 mode	agent1	initial_cond	0	-1.520921
exp157	5.55111512e-17	1.001322	1.000049	discard	Positive: fourier_modes=1, amp=0.0, u_offset=1.0	agent3	initial_cond	0	-1.520921
exp158	2.00148302e-16	1.001298	1.000025	discard	Positive branch, 2 modes, newton_tol=1e-14	agent1	initial_cond	0	-1.520921
exp159	5.55111512e-17	1.001322	1.000049	discard	positive branch fourier 1mode optimal tol=1.2e-16	agent2	initial_cond	0	-1.520921
exp160	8.82085992e-15	1.001322	-1.000049	discard	negative branch u_offset=-0.9	agent1	initial_cond	1	-1.520921
exp161	5.55111512e-17	1.001322	-1.000049	discard	negative branch u_offset=-0.95	agent1	initial_cond	0	-1.520921
exp162	5.55111512e-17	1.001322	-1.000049	discard	negative branch u_offset=-1.0	agent1	initial_cond	0	-1.520921
exp163	3.22251676e-15	1.001322	-1.000049	discard	negative branch u_offset=-1.05	agent1	initial_cond	0	-1.520921
exp164	2.51704969e-15	1.001322	-1.000049	discard	negative branch u_offset=-1.1	agent1	initial_cond	1	-1.520921
exp165	5.55111512e-17	1.001322	1.000049	discard	Optimal positive branch: 1 mode, tol=1.2e-16, amp=0.15	agent0	initial_cond	0	-1.520921
exp166	2.57581612e-16	1.001296	1.000019	discard	u_offset=2.0 looking for 4th branch	agent2	initial_cond	0	-1.520844
exp167	2.73503502e-11	1.002503	1.000218	discard	Scipy positive: n_nodes=50, tol=1e-10	agent3	initial_cond	0	-1.523848
exp168	5.55111512e-17	1.001322	-1.000049	discard	Optimal negative branch: 1 mode, tol=1.2e-16, amp=0.15	agent0	initial_cond	0	-1.520921
exp169	3.83715186e-16	1.001296	-1.000019	discard	u_offset=-2.0 looking for 4th branch	agent2	initial_cond	1	-1.520844
exp170	2.95344661e-15	1.001296	1.000019	discard	n_mode=3 amp=0.5 u_offset=0.3 looking for complex solution	agent2	initial_cond	1	-1.520844
exp171	5.55111512e-17	1.001322	1.000049	discard	Positive branch, n_mode=0 (constant IC), 1 fourier mode	agent1	initial_cond	0	-1.520921
exp172	8.33514194e-24	0.000000	0.000000	discard	u_offset=0 amp=0.5 16modes looking for oscillatory solution	agent2	initial_cond	0	0.000000
exp173	5.55111512e-17	1.001322	1.000049	discard	Positive: fourier_modes=1, amp=0.5	agent3	initial_cond	1	-1.520921
exp174	5.55111512e-17	1.001322	1.000049	discard	Positive branch, exact solution IC, 1 mode	agent0	initial_cond	1	-1.520921
exp175	5.55111512e-17	1.001322	-1.000049	discard	basin test offset=0.55	agent1	initial_cond	0	-1.520921
exp176	5.55111512e-17	1.001322	-1.000049	discard	basin test offset=0.56	agent1	initial_cond	1	-1.520921
exp177	5.55111512e-17	1.001322	-1.000049	discard	basin test offset=0.57	agent1	initial_cond	0	-1.520921
exp178	1.75541673e-16	1.001322	1.000049	discard	basin test offset=0.572	agent1	initial_cond	0	-1.520921
exp179	5.55111512e-17	1.001322	1.000049	discard	basin test offset=0.573	agent1	initial_cond	0	-1.520921
