exp_id	residual	solution_norm	solution_mean	status	description	agent	design	elapsed_s	solution_energy
exp179	5.55111512e-17	1.001322	1.000049	discard	Positive branch 1 mode amp=0.3 newton_tol=1.5e-16	agent3	initial_cond	0	-1.520921
exp180	0.00000000e+00	0.000000	0.000000	discard	trivial branch fourier 1 mode amp=0 exact solution	agent2	solver	0	0.000000
exp181	2.39481333e-29	0.000000	-0.000000	discard	trivial branch 1 mode amp=0.01	agent0	initial_cond	0	-0.000000
exp182	5.55111512e-17	1.001322	1.000049	discard	Positive branch 1 mode amp=0 constant IC	agent3	initial_cond	0	-1.520921
exp183	2.00148302e-16	1.001298	1.000025	discard	positive 2 modes amp=0.3	agent0	initial_cond	0	-1.520921
exp184	5.55111512e-17	1.001322	1.000049	discard	Branch +: Fourier 1 mode u_offset=1.0 amp=0.1 newton_tol=1.12e-16 edge test	agent1	initial_cond	0	-1.520921
exp185	2.00148302e-16	1.001298	1.000025	discard	positive 2 modes amp=0.3 newton_tol=3e-16	agent0	solver	0	-1.520921
exp186	2.00148302e-16	1.001298	1.000025	discard	positive 2 modes amp=0.5	agent0	initial_cond	0	-1.520921
exp187	0.00000000e+00	0.000000	0.000000	discard	Trivial branch 1 mode u_offset=0 amp=0 newton_tol=1.5e-16	agent3	solver	0	0.000000
exp188	5.55111512e-17	1.001322	1.000049	discard	positive branch fourier 1 mode amp=0.09	agent2	solver	0	-1.520921
exp189	5.55111512e-17	1.001322	-1.000049	discard	1 mode u_offset=0.5 amp=0.1 - which branch?	agent3	initial_cond	0	-1.520921
exp190	4.08714808e-27	0.000000	0.000000	discard	1 mode u_offset=0.3 amp=0.1 basin exploration	agent3	initial_cond	0	-0.000000
exp191	5.55111512e-17	1.001322	1.000049	discard	Positive 1 mode n_mode=2 initial guess	agent3	initial_cond	1	-1.520921
