exp_id	residual	solution_norm	solution_mean	status	description	agent	design	elapsed_s	solution_energy
exp547	1.38982101e-14	1.001296	-1.000019	discard	boundary N=16 iter=2 u_offset=0.5850000	agent1	branch_search	0	-1.520844
exp548	1.53925106e-14	1.001296	-1.000019	discard	boundary N=16 iter=3 u_offset=0.5875000	agent1	branch_search	0	-1.520844
exp549	3.18069763e-14	1.001296	-1.000019	discard	boundary N=16 iter=4 u_offset=0.5887500	agent1	branch_search	1	-1.520844
exp550	8.42042877e-15	1.001296	-1.000019	discard	boundary N=16 iter=5 u_offset=0.5893750	agent1	branch_search	0	-1.520844
exp551	9.34739592e-15	1.001296	-1.000019	discard	boundary N=16 iter=6 u_offset=0.5896875	agent1	branch_search	0	-1.520844
exp552	6.79726162e-15	1.001296	1.000019	discard	boundary N=16 iter=7 u_offset=0.5898438	agent1	branch_search	0	-1.520844
exp553	9.32392218e-15	1.001296	1.000019	discard	boundary N=16 iter=8 u_offset=0.5897657	agent1	branch_search	0	-1.520844
exp554	1.53984658e-14	1.001296	-1.000019	discard	boundary N=16 iter=9 u_offset=0.5897266	agent1	branch_search	1	-1.520844
exp555	1.15444584e-14	1.001296	1.000019	discard	boundary N=16 iter=10 u_offset=0.5897461	agent1	branch_search	0	-1.520844
exp556	2.57581612e-16	1.001296	-1.000019	discard	Newton iterations u_offset=0.5895	agent1	branch_search	1	-1.520844
exp557	2.08871080e-15	1.001296	-1.000019	discard	Newton iterations u_offset=0.5896	agent1	branch_search	0	-1.520844
exp558	3.47776366e-16	1.001296	-1.000019	discard	Newton iterations u_offset=0.58970	agent1	branch_search	0	-1.520844
exp559	1.96261557e-16	1.001296	-1.000019	discard	Newton iterations u_offset=0.58972	agent1	branch_search	1	-1.520844
exp560	1.96261557e-16	1.001296	-1.000019	discard	Newton iterations u_offset=0.58973	agent1	branch_search	0	-1.520844
exp561	3.77006140e-16	1.001296	-1.000019	discard	Newton iterations u_offset=0.589734	agent1	branch_search	0	-1.520844
exp562	3.74957179e-16	1.001296	1.000019	discard	Newton iterations u_offset=0.589735	agent1	branch_search	1	-1.520844
exp563	2.06774381e-16	1.001296	1.000019	discard	Newton iterations u_offset=0.58974	agent1	branch_search	0	-1.520844
exp564	2.10832785e-15	1.001296	1.000019	discard	Newton iterations u_offset=0.58975	agent1	branch_search	0	-1.520844
exp565	1.96261557e-16	1.001296	1.000019	discard	Newton iterations u_offset=0.5898	agent1	branch_search	1	-1.520844
exp566	2.06774381e-16	1.001296	1.000019	discard	Newton iterations u_offset=0.5899	agent1	branch_search	0	-1.520844
exp567	2.02539645e-15	1.001296	1.000019	discard	Newton iterations u_offset=0.590	agent1	branch_search	0	-1.520844
exp568	2.30011512e-15	1.001296	1.000019	discard	Newton iterations u_offset=0.60	agent1	branch_search	1	-1.520844
exp569	2.47275774e-21	0.000000	0.000000	discard	Newton iterations trivial boundary u_offset=0.30	agent1	branch_search	0	-0.000000
exp570	1.99822732e-23	0.000000	0.000000	discard	Newton iterations trivial boundary u_offset=0.40	agent1	branch_search	0	-0.000000
exp571	3.95472498e-16	0.000000	0.000000	discard	Newton iterations trivial boundary u_offset=0.45	agent1	branch_search	0	-0.000000
exp572	2.42370301e-25	0.000000	-0.000000	discard	Newton iterations trivial boundary u_offset=0.460	agent1	branch_search	0	0.000000
exp573	3.16515254e-19	0.000000	0.000000	discard	Newton iterations trivial boundary u_offset=0.461	agent1	branch_search	1	-0.000000
exp574	1.22200796e-28	0.000000	-0.000000	discard	Newton iterations trivial boundary u_offset=0.462	agent1	branch_search	0	0.000000
exp575	5.89101295e-16	0.000000	0.000000	discard	Newton iterations trivial boundary u_offset=0.46201	agent1	branch_search	0	-0.000000
exp576	4.60327404e-15	0.000000	0.000000	discard	Newton iterations trivial boundary u_offset=0.462015	agent1	branch_search	1	-0.000000
exp577	3.83328516e-15	1.001296	1.000019	discard	Newton iterations trivial boundary u_offset=0.46202	agent1	branch_search	0	-1.520844
exp578	2.06774381e-16	1.001296	1.000019	discard	Newton iterations trivial boundary u_offset=0.4621	agent1	branch_search	0	-1.520844
exp579	3.83328516e-15	1.001296	-1.000019	discard	Newton iterations trivial boundary u_offset=0.463	agent1	branch_search	0	-1.520844
exp580	2.06774381e-16	1.001296	-1.000019	discard	Newton iterations trivial boundary u_offset=0.47	agent1	branch_search	0	-1.520844
exp581	3.77006140e-16	1.001296	-1.000019	discard	Newton iterations trivial boundary u_offset=0.50	agent1	branch_search	1	-1.520844
exp582	2.37755119e-15	1.001296	1.000019	discard	no description	agent0	initial_cond	0	-1.520844
exp583	2.36236989e-15	1.001296	1.000019	discard	no description	agent1	initial_cond	0	-1.520844
exp584	3.88532027e-15	1.001296	-1.000019	discard	no description	agent1	initial_cond	0	-1.520844
exp585	3.94830178e-16	0.000000	0.000000	discard	no description	agent1	initial_cond	0	-0.000000
exp586	6.55161438e-20	0.000000	0.000000	discard	no description	agent1	initial_cond	0	-0.000000
exp587	7.74230642e-25	0.000000	0.000000	discard	no description	agent1	initial_cond	0	-0.000000
exp588	3.31851743e-15	1.001296	-1.000019	discard	no description	agent1	initial_cond	0	-1.520844
exp589	2.45851541e-15	1.001296	-1.000019	discard	no description	agent1	initial_cond	0	-1.520844
exp590	5.84729156e-15	1.001296	1.000019	discard	no description	agent1	initial_cond	0	-1.520844
exp591	2.51478701e-15	1.001296	1.000019	discard	no description	agent1	initial_cond	0	-1.520844
exp592	2.29839933e-15	1.001296	-1.000019	discard	no description	agent1	initial_cond	0	-1.520844
exp593	3.37525841e-15	1.001296	-1.000019	discard	no description	agent1	initial_cond	1	-1.520844
exp594	6.01860723e-15	1.001296	-1.000019	discard	no description	agent1	initial_cond	0	-1.520844
exp595	2.37634737e-15	1.001296	1.000019	discard	no description	agent1	initial_cond	0	-1.520844
exp596	2.69439126e-24	0.000000	-0.000000	discard	no description	agent1	initial_cond	0	-0.000000
exp597	3.07114730e-15	1.001296	1.000019	discard	no description	agent1	initial_cond	1	-1.520844
exp598	6.06290198e-16	1.001296	1.000019	discard	no description	agent0	initial_cond	1	-1.520844
exp599	2.08188611e-15	1.001296	-1.000019	discard	no description	agent1	initial_cond	0	-1.520844
exp600	3.59087085e-15	1.001296	-1.000019	discard	no description	agent1	initial_cond	0	-1.520844
exp601	1.96066697e-15	1.001296	1.000019	discard	no description	agent1	initial_cond	1	-1.520844
exp602	3.15704950e-15	1.001296	1.000019	discard	no description	agent1	initial_cond	0	-1.520844
exp603	2.26884027e-15	1.001296	-1.000019	discard	no description	agent1	initial_cond	0	-1.520844
exp604	2.44299468e-15	1.001296	-1.000019	discard	no description	agent1	initial_cond	1	-1.520844
exp605	1.94297280e-15	1.001296	-1.000019	discard	no description	agent1	initial_cond	0	-1.520844
exp606	2.35057914e-15	1.001296	1.000019	discard	no description	agent1	initial_cond	0	-1.520844
exp607	1.52391128e-15	1.001296	1.000019	discard	no description	agent0	initial_cond	0	-1.520844
exp608	1.01765301e-15	1.001296	1.000019	discard	no description	agent0	initial_cond	0	-1.520844
exp609	5.31199706e-15	1.001296	1.000019	discard	no description	agent0	initial_cond	1	-1.520844
exp610	2.54061235e-15	1.001296	1.000019	discard	no description	agent0	initial_cond	0	-1.520844
exp611	9.99977750e-12	1.002503	1.000218	discard	no description	agent0	initial_cond	0	-1.523848
exp612	crash	0	0	crash	no description	agent0	initial_cond	0	0
exp613	crash	0	0	crash	no description	agent0	initial_cond	1	0
exp614	7.99960957e-12	1.002503	1.000218	discard	no description	agent0	initial_cond	0	-1.523848
exp615	crash	0	0	crash	no description	agent0	initial_cond	0	0
exp616	crash	0	0	crash	no description	agent0	initial_cond	0	0
exp617	4.88713462e-12	1.002503	1.000218	discard	no description	agent0	initial_cond	1	-1.523848
exp618	2.59979497e-15	1.001296	1.000019	discard	no description	agent1	initial_cond	0	-1.520844
exp619	2.38802236e-15	1.001296	1.000019	discard	no description	agent1	initial_cond	0	-1.520844
exp620	1.84381892e-15	1.001296	1.000019	discard	no description	agent1	initial_cond	1	-1.520844
exp621	2.22181719e-15	1.001296	1.000019	discard	no description	agent1	initial_cond	0	-1.520844
exp622	6.37579922e-15	1.001296	1.000019	discard	no description	agent1	initial_cond	0	-1.520844
exp623	3.56453274e-15	1.001296	1.000019	discard	no description	agent1	initial_cond	1	-1.520844
exp624	2.59979497e-15	1.001296	-1.000019	discard	no description	agent1	initial_cond	0	-1.520844
exp625	1.84381892e-15	1.001296	-1.000019	discard	no description	agent1	initial_cond	0	-1.520844
exp626	3.56453274e-15	1.001296	-1.000019	discard	no description	agent1	initial_cond	1	-1.520844
exp627	7.14807580e-23	0.000000	0.000000	discard	no description	agent1	initial_cond	0	-0.000000
exp628	2.27950681e-26	0.000000	0.000000	discard	no description	agent1	initial_cond	0	-0.000000
exp629	1.78365683e-26	0.000000	0.000000	discard	no description	agent1	initial_cond	0	-0.000000
exp630	3.94830178e-16	0.000000	0.000000	discard	no description	agent1	initial_cond	0	-0.000000
exp631	1.47238502e-23	0.000000	0.000000	discard	no description	agent1	initial_cond	0	-0.000000
exp632	3.86339912e-17	0.000000	0.000000	discard	no description	agent1	initial_cond	1	-0.000000
exp633	7.74230642e-25	0.000000	0.000000	discard	no description	agent1	initial_cond	0	-0.000000
exp634	2.49522079e-19	0.000000	0.000000	discard	no description	agent1	initial_cond	0	-0.000000
exp635	7.33082195e-26	0.000000	0.000000	discard	no description	agent1	initial_cond	1	-0.000000
exp636	5.56468402e-20	0.000000	0.000000	discard	no description	agent1	initial_cond	0	-0.000000
exp637	3.03804568e-15	1.001296	1.000019	discard	no description	agent1	initial_cond	0	-1.520844
exp638	1.89353672e-15	1.001296	1.000019	discard	no description	agent1	initial_cond	1	-1.520844
exp639	2.81276426e-15	1.001296	-1.000019	discard	no description	agent1	initial_cond	0	-1.520844
exp640	3.31851743e-15	1.001296	-1.000019	discard	no description	agent1	initial_cond	0	-1.520844
exp641	2.45851541e-15	1.001296	-1.000019	discard	no description	agent1	initial_cond	1	-1.520844
exp642	2.51478701e-15	1.001296	1.000019	discard	no description	agent1	initial_cond	0	-1.520844
exp643	2.29839933e-15	1.001296	-1.000019	discard	no description	agent1	initial_cond	0	-1.520844
