exp_id	residual	solution_norm	solution_mean	status	description	agent	design	elapsed_s	solution_energy
exp362	2.07949285e-15	1.001296	1.000019	discard	2D basin u_offset=0.465 amp=0.2	agent1	branch_search	1	-1.520844
exp363	2.57581612e-16	1.001296	1.000019	discard	2D basin u_offset=0.465 amp=0.3	agent1	branch_search	0	-1.520844
exp364	4.37535640e-16	1.001296	1.000019	discard	2D basin u_offset=0.465 amp=0.5	agent1	branch_search	0	-1.520844
exp365	2.06774381e-16	1.001296	-1.000019	discard	2D basin u_offset=0.47 amp=0.0	agent1	branch_search	1	-1.520844
exp366	2.06774381e-16	1.001296	-1.000019	discard	2D basin u_offset=0.47 amp=0.1	agent1	branch_search	0	-1.520844
exp367	3.77006140e-16	1.001296	-1.000019	discard	2D basin u_offset=0.47 amp=0.2	agent1	branch_search	0	-1.520844
exp368	1.86448479e-16	1.001296	-1.000019	discard	2D basin u_offset=0.47 amp=0.3	agent1	branch_search	1	-1.520844
exp369	1.96261557e-16	1.001296	1.000019	discard	2D basin u_offset=0.47 amp=0.5	agent1	branch_search	0	-1.520844
exp370	3.62021453e-16	1.001296	1.000019	discard	2D basin u_offset=0.475 amp=0.0	agent1	branch_search	0	-1.520844
exp371	2.08871080e-15	1.001296	-1.000019	discard	2D basin u_offset=0.475 amp=0.1	agent1	branch_search	1	-1.520844
exp372	4.00777441e-16	1.001296	1.000019	discard	2D basin u_offset=0.475 amp=0.2	agent1	branch_search	0	-1.520844
exp373	2.04903081e-16	1.001296	1.000019	discard	2D basin u_offset=0.475 amp=0.3	agent1	branch_search	0	-1.520844
exp374	2.03885438e-15	1.001296	1.000019	discard	2D basin u_offset=0.475 amp=0.5	agent1	branch_search	1	-1.520844
exp375	2.57581612e-16	1.001296	1.000019	discard	2D basin u_offset=0.48 amp=0.0	agent1	branch_search	0	-1.520844
exp376	4.00777441e-16	1.001296	-1.000019	discard	2D basin u_offset=0.48 amp=0.1	agent1	branch_search	0	-1.520844
exp377	2.04903081e-16	1.001296	-1.000019	discard	2D basin u_offset=0.48 amp=0.2	agent1	branch_search	1	-1.520844
exp378	3.62021453e-16	1.001296	1.000019	discard	2D basin u_offset=0.48 amp=0.3	agent1	branch_search	0	-1.520844
exp379	2.04903081e-16	1.001296	1.000019	discard	2D basin u_offset=0.48 amp=0.5	agent1	branch_search	0	-1.520844
exp380	3.77006140e-16	1.001296	-1.000019	discard	2D basin u_offset=0.50 amp=0.0	agent1	branch_search	1	-1.520844
exp381	2.09614326e-15	1.001296	-1.000019	discard	2D basin u_offset=0.50 amp=0.1	agent1	branch_search	0	-1.520844
exp382	2.06774381e-16	1.001296	-1.000019	discard	2D basin u_offset=0.50 amp=0.2	agent1	branch_search	0	-1.520844
exp383	2.57581612e-16	1.001296	1.000019	discard	2D basin u_offset=0.50 amp=0.3	agent1	branch_search	0	-1.520844
exp384	1.96261557e-16	1.001296	1.000019	discard	2D basin u_offset=0.50 amp=0.5	agent1	branch_search	0	-1.520844
exp385	2.57581612e-16	1.001296	-1.000019	discard	2D basin u_offset=0.55 amp=0.0	agent1	branch_search	0	-1.520844
exp386	6.34216421e-16	1.001296	-1.000019	discard	2D basin u_offset=0.55 amp=0.1	agent1	branch_search	0	-1.520844
exp387	2.06774381e-16	1.001296	-1.000019	discard	2D basin u_offset=0.55 amp=0.2	agent1	branch_search	0	-1.520844
exp388	6.84480717e-27	0.000000	-0.000000	discard	mode-3 refine u_offset=0.445	agent0	branch_search	0	0.000000
exp388	5.01524128e-16	1.001296	-1.000019	discard	2D basin u_offset=0.55 amp=0.3	agent1	branch_search	0	-1.520844
exp389	1.58190509e-19	0.000000	0.000000	discard	mode-3 refine u_offset=0.450	agent0	branch_search	0	-0.000000
exp389	5.71859165e-16	1.001296	1.000019	discard	2D basin u_offset=0.55 amp=0.5	agent1	branch_search	0	-1.520844
exp390	1.35688793e-15	0.000000	0.000000	discard	mode-3 refine u_offset=0.455	agent0	branch_search	0	-0.000000
exp391	3.62021453e-16	1.001296	-1.000019	discard	2D basin u_offset=0.57 amp=0.0	agent1	branch_search	0	-1.520844
exp392	2.57581612e-16	1.001296	-1.000019	discard	2D basin u_offset=0.57 amp=0.1	agent1	branch_search	0	-1.520844
exp393	2.06774381e-16	1.001296	-1.000019	discard	mode-3 refine u_offset=0.580	agent0	branch_search	0	-1.520844
exp394	2.04903081e-16	1.001296	-1.000019	discard	mode-3 refine u_offset=0.585	agent0	branch_search	1	-1.520844
exp394	4.21048514e-16	1.001296	-1.000019	discard	2D basin u_offset=0.57 amp=0.2	agent1	branch_search	0	-1.520844
exp395	3.62021453e-16	1.001296	1.000019	discard	mode-3 refine u_offset=0.590	agent0	branch_search	0	-1.520844
exp396	2.06774381e-16	1.001296	-1.000019	discard	2D basin u_offset=0.57 amp=0.3	agent1	branch_search	0	-1.520844
exp397	3.62021453e-16	1.001296	1.000019	discard	mode-3 refine u_offset=0.595	agent0	branch_search	0	-1.520844
exp398	3.09720388e-15	1.001296	1.000019	discard	2D basin u_offset=0.57 amp=0.5	agent1	branch_search	0	-1.520844
exp399	7.20108768e-16	1.001296	-1.000019	discard	2D basin u_offset=0.58 amp=0.0	agent1	branch_search	0	-1.520844
exp400	6.01806552e-16	1.001296	1.000019	discard	2D basin u_offset=0.58 amp=0.1	agent1	branch_search	0	-1.520844
exp401	3.62021453e-16	1.001296	-1.000019	discard	2D basin u_offset=0.58 amp=0.2	agent1	branch_search	0	-1.520844
exp402	2.04903081e-16	1.001296	-1.000019	discard	2D basin u_offset=0.58 amp=0.3	agent1	branch_search	0	-1.520844
exp403	1.86448479e-16	1.001296	1.000019	discard	2D basin u_offset=0.58 amp=0.5	agent1	branch_search	0	-1.520844
exp404	2.02539645e-15	1.001296	1.000019	discard	2D basin u_offset=0.59 amp=0.0	agent1	branch_search	1	-1.520844
exp405	2.00532833e-15	1.001296	1.000019	discard	2D basin u_offset=0.59 amp=0.1	agent1	branch_search	0	-1.520844
exp406	2.57581612e-16	1.001296	1.000019	discard	2D basin u_offset=0.59 amp=0.2	agent1	branch_search	0	-1.520844
exp407	1.96261557e-16	1.001296	-1.000019	discard	2D basin u_offset=0.59 amp=0.3	agent1	branch_search	1	-1.520844
exp408	2.57581612e-16	1.001296	-1.000019	discard	2D basin u_offset=0.59 amp=0.5	agent1	branch_search	0	-1.520844
exp409	2.30011512e-15	1.001296	1.000019	discard	2D basin u_offset=0.60 amp=0.0	agent1	branch_search	0	-1.520844
exp410	1.96261557e-16	1.001296	1.000019	discard	2D basin u_offset=0.60 amp=0.1	agent1	branch_search	1	-1.520844
exp411	3.93013462e-16	1.001296	1.000019	discard	2D basin u_offset=0.60 amp=0.2	agent1	branch_search	0	-1.520844
exp412	1.96261557e-16	1.001296	-1.000019	discard	2D basin u_offset=0.60 amp=0.3	agent1	branch_search	0	-1.520844
exp413	4.99600361e-16	1.001296	-1.000019	discard	2D basin u_offset=0.60 amp=0.5	agent1	branch_search	1	-1.520844
exp414	2.06774381e-16	1.001296	1.000019	discard	mode-3 fine u_offset=0.456	agent0	branch_search	1	-1.520844
exp415	2.06774381e-16	1.001296	1.000019	discard	mode-3 fine u_offset=0.457	agent0	branch_search	0	-1.520844
exp416	2.57581612e-16	1.001296	-1.000019	discard	mode-3 fine u_offset=0.458	agent0	branch_search	0	-1.520844
exp417	2.57581612e-16	1.001296	-1.000019	discard	mode-3 fine u_offset=0.459	agent0	branch_search	1	-1.520844
exp418	4.00777441e-16	1.001296	-1.000019	discard	mode-3 fine u_offset=0.460	agent0	branch_search	0	-1.520844
exp419	3.96566134e-15	1.001296	-1.000019	discard	mode-3 fine u_offset=0.461	agent0	branch_search	0	-1.520844
exp420	1.88564362e-15	1.001296	-1.000019	discard	mode-3 fine u_offset=0.586	agent0	branch_search	1	-1.520844
exp421	4.82040919e-16	1.001296	-1.000019	discard	mode-3 fine u_offset=0.587	agent0	branch_search	0	-1.520844
exp422	2.06774381e-16	1.001296	1.000019	discard	mode-3 fine u_offset=0.588	agent0	branch_search	0	-1.520844
exp423	1.86448479e-16	1.001296	1.000019	discard	mode-3 fine u_offset=0.589	agent0	branch_search	0	-1.520844
exp424	1.22200796e-28	0.000000	-0.000000	discard	energy analysis u_offset=0.4620	agent1	branch_search	1	0.000000
exp425	2.06774381e-16	1.001296	1.000019	discard	energy analysis u_offset=0.4621	agent1	branch_search	0	-1.520844
exp426	2.73184526e-16	1.001296	-1.000019	discard	energy analysis u_offset=0.4622	agent1	branch_search	0	-1.520844
exp427	1.99734105e-15	1.001296	1.000019	discard	energy analysis u_offset=0.4625	agent1	branch_search	1	-1.520844
exp428	3.83328516e-15	1.001296	-1.000019	discard	energy analysis u_offset=0.4630	agent1	branch_search	0	-1.520844
exp429	2.06774381e-16	1.001296	-1.000019	discard	energy analysis u_offset=0.47	agent1	branch_search	0	-1.520844
exp430	3.77006140e-16	1.001296	-1.000019	discard	energy analysis u_offset=0.50	agent1	branch_search	1	-1.520844
exp431	7.20108768e-16	1.001296	-1.000019	discard	energy analysis u_offset=0.58	agent1	branch_search	0	-1.520844
exp432	3.47776366e-16	1.001296	-1.000019	discard	energy analysis u_offset=0.5897	agent1	branch_search	1	-1.520844
exp433	1.96261557e-16	1.001296	1.000019	discard	energy analysis u_offset=0.5898	agent1	branch_search	0	-1.520844
exp434	2.30011512e-15	1.001296	1.000019	discard	energy analysis u_offset=0.60	agent1	branch_search	0	-1.520844
exp435	2.57581612e-16	1.001296	1.000019	discard	energy analysis u_offset=0.90	agent1	branch_search	1	-1.520844
exp436	1.89920454e-15	1.001296	1.000019	discard	energy analysis u_offset=1.0	agent1	branch_search	0	-1.520844
exp437	1.22200796e-28	0.000000	-0.000000	discard	ultra-fine trivial boundary u_offset=0.462000	agent1	branch_search	0	0.000000
exp438	6.56722657e-25	0.000000	0.000000	discard	ultra-fine trivial boundary u_offset=0.462005	agent1	branch_search	0	0.000000
exp439	5.89101295e-16	0.000000	0.000000	discard	ultra-fine trivial boundary u_offset=0.462010	agent1	branch_search	1	-0.000000
exp440	4.60327404e-15	0.000000	0.000000	discard	ultra-fine trivial boundary u_offset=0.462015	agent1	branch_search	0	-0.000000
exp441	3.83328516e-15	1.001296	1.000019	discard	ultra-fine trivial boundary u_offset=0.462020	agent1	branch_search	0	-1.520844
exp442	7.13766346e-15	1.001296	-1.000019	discard	ultra-fine trivial boundary u_offset=0.462025	agent1	branch_search	0	-1.520844
exp443	1.96261557e-16	1.001296	-1.000019	discard	ultra-fine trivial boundary u_offset=0.462030	agent1	branch_search	0	-1.520844
exp444	3.62021453e-16	1.001296	1.000019	discard	ultra-fine trivial boundary u_offset=0.462035	agent1	branch_search	0	-1.520844
exp445	2.03322616e-15	1.001296	1.000019	discard	ultra-fine trivial boundary u_offset=0.462040	agent1	branch_search	0	-1.520844
exp446	1.88564362e-15	1.001296	-1.000019	discard	ultra-fine trivial boundary u_offset=0.462045	agent1	branch_search	0	-1.520844
exp447	3.62021453e-16	1.001296	-1.000019	discard	ultra-fine trivial boundary u_offset=0.462050	agent1	branch_search	0	-1.520844
exp448	4.60327404e-15	0.000000	0.000000	discard	ultra-ultra-fine u_offset=0.4620150	agent1	branch_search	0	-0.000000
exp449	1.86448479e-16	1.001296	-1.000019	discard	ultra-ultra-fine u_offset=0.4620160	agent1	branch_search	0	-1.520844
exp450	2.06774381e-16	1.001296	-1.000019	discard	ultra-ultra-fine u_offset=0.4620170	agent1	branch_search	1	-1.520844
exp451	7.36177075e-16	1.001296	-1.000019	discard	ultra-ultra-fine u_offset=0.4620180	agent1	branch_search	0	-1.520844
exp452	1.93583948e-15	1.001296	1.000019	discard	ultra-ultra-fine u_offset=0.4620190	agent1	branch_search	0	-1.520844
exp453	3.83328516e-15	1.001296	1.000019	discard	ultra-ultra-fine u_offset=0.4620200	agent1	branch_search	1	-1.520844
exp454	4.60327404e-15	0.000000	0.000000	discard	10^-7 resolution u_offset=0.46201500	agent1	branch_search	1	-0.000000
exp455	2.04903081e-16	1.001296	-1.000019	discard	10^-7 resolution u_offset=0.46201520	agent1	branch_search	0	-1.520844
exp456	2.73184526e-16	1.001296	1.000019	discard	10^-7 resolution u_offset=0.46201540	agent1	branch_search	0	-1.520844
exp457	1.96261557e-16	1.001296	1.000019	discard	10^-7 resolution u_offset=0.46201560	agent1	branch_search	1	-1.520844
exp458	2.30730482e-15	1.001296	-1.000019	discard	10^-7 resolution u_offset=0.46201580	agent1	branch_search	0	-1.520844
exp459	1.86448479e-16	1.001296	-1.000019	discard	10^-7 resolution u_offset=0.46201600	agent1	branch_search	0	-1.520844
exp460	1.96261557e-16	1.001296	1.000019	discard	residual vs phase at u_offset=1.0	agent1	perturbation	0	-1.520844
exp461	2.57581612e-16	1.001296	1.000019	discard	residual vs phase at u_offset=1.0	agent1	perturbation	0	-1.520844
exp462	1.95839140e-15	1.001296	1.000019	discard	residual vs phase at u_offset=1.0	agent1	perturbation	1	-1.520844
exp463	5.22310230e-16	1.001296	1.000019	discard	residual vs phase at u_offset=1.0	agent1	perturbation	0	-1.520844
exp464	2.06774381e-16	1.001296	1.000019	discard	residual vs phase at u_offset=1.0	agent1	perturbation	0	-1.520844
exp465	2.04903081e-16	1.001296	1.000019	discard	residual vs phase at u_offset=1.0	agent1	perturbation	1	-1.520844
exp466	2.04903081e-16	1.001296	1.000019	discard	residual vs phase at u_offset=1.0	agent1	perturbation	0	-1.520844
exp467	2.04173342e-15	1.001296	1.000019	discard	residual vs phase at u_offset=1.0	agent1	perturbation	0	-1.520844
exp468	2.57581612e-16	1.001296	1.000019	discard	residual vs phase at u_offset=1.0	agent1	perturbation	1	-1.520844
exp469	2.57581612e-16	1.001296	1.000019	discard	residual vs phase at u_offset=1.0	agent1	perturbation	0	-1.520844
exp470	2.08871080e-15	1.001296	1.000019	discard	residual vs phase at u_offset=1.0	agent1	perturbation	0	-1.520844
exp471	3.93013462e-16	1.001296	1.000019	discard	residual vs phase at u_offset=1.0	agent1	perturbation	1	-1.520844
exp472	2.06774381e-16	1.001296	1.000019	discard	residual vs phase at u_offset=1.0	agent1	perturbation	0	-1.520844
exp473	2.06774381e-16	1.001296	1.000019	discard	optimal u_offset=0.9 for residual	agent1	initial_cond	0	-1.520844
exp474	2.06774381e-16	1.001296	1.000019	discard	optimal u_offset=0.95 for residual	agent1	initial_cond	0	-1.520844
exp475	2.06774381e-16	1.001296	1.000019	discard	optimal u_offset=0.98 for residual	agent1	initial_cond	1	-1.520844
exp476	3.64042705e-15	1.001296	1.000019	discard	optimal u_offset=0.99 for residual	agent1	initial_cond	0	-1.520844
exp477	1.96261557e-16	1.001296	1.000019	discard	optimal u_offset=1.0 for residual	agent1	initial_cond	0	-1.520844
exp478	2.57581612e-16	1.001296	1.000019	discard	optimal u_offset=1.000019 for residual	agent1	initial_cond	1	-1.520844
exp479	3.34221389e-16	1.001296	1.000019	discard	optimal u_offset=1.001 for residual	agent1	initial_cond	0	-1.520844
exp480	3.64391704e-15	1.001296	1.000019	discard	optimal u_offset=1.01 for residual	agent1	initial_cond	0	-1.520844
exp481	2.57581612e-16	1.001296	1.000019	discard	optimal u_offset=1.02 for residual	agent1	initial_cond	1	-1.520844
exp482	1.96261557e-16	1.001296	1.000019	discard	optimal u_offset=1.05 for residual	agent1	initial_cond	0	-1.520844
exp483	1.96261557e-16	1.001296	1.000019	discard	optimal u_offset=1.1 for residual	agent1	initial_cond	0	-1.520844
exp484	3.47776366e-16	1.001296	-1.000019	discard	Wada at pos/neg boundary u_offset=0.589700	agent1	branch_search	0	-1.520844
exp485	1.96261557e-16	1.001296	-1.000019	discard	Wada at pos/neg boundary u_offset=0.589720	agent1	branch_search	0	-1.520844
exp486	2.06774381e-16	1.001296	1.000019	discard	Wada at pos/neg boundary u_offset=0.589740	agent1	branch_search	1	-1.520844
exp487	2.10832785e-15	1.001296	1.000019	discard	Wada at pos/neg boundary u_offset=0.589750	agent1	branch_search	0	-1.520844
exp488	2.02615702e-15	1.001296	1.000019	discard	Wada at pos/neg boundary u_offset=0.589760	agent1	branch_search	0	-1.520844
exp489	3.47776366e-16	1.001296	1.000019	discard	Wada at pos/neg boundary u_offset=0.589770	agent1	branch_search	1	-1.520844
exp490	1.96261557e-16	1.001296	1.000019	discard	Wada at pos/neg boundary u_offset=0.589780	agent1	branch_search	0	-1.520844
exp491	4.99600361e-16	1.001296	1.000019	discard	Wada at pos/neg boundary u_offset=0.589790	agent1	branch_search	0	-1.520844
exp492	1.96261557e-16	1.001296	1.000019	discard	Wada at pos/neg boundary u_offset=0.589800	agent1	branch_search	1	-1.520844
exp493	1.96261557e-16	1.001296	-1.000019	discard	Wada fine u_offset=0.5897200	agent1	branch_search	1	-1.520844
exp494	6.34216421e-16	1.001296	-1.000019	discard	Wada fine u_offset=0.5897220	agent1	branch_search	0	-1.520844
exp495	2.57581612e-16	1.001296	-1.000019	discard	Wada fine u_offset=0.5897240	agent1	branch_search	0	-1.520844
exp496	1.86448479e-16	1.001296	-1.000019	discard	Wada fine u_offset=0.5897260	agent1	branch_search	0	-1.520844
exp497	1.23633098e-15	1.001296	-1.000019	discard	Wada fine u_offset=0.5897280	agent1	branch_search	0	-1.520844
exp498	1.96261557e-16	1.001296	-1.000019	discard	Wada fine u_offset=0.5897300	agent1	branch_search	0	-1.520844
exp499	2.06774381e-16	1.001296	-1.000019	discard	Wada fine u_offset=0.5897320	agent1	branch_search	0	-1.520844
exp500	3.77006140e-16	1.001296	-1.000019	discard	Wada fine u_offset=0.5897340	agent1	branch_search	0	-1.520844
exp501	3.52178773e-16	1.001296	1.000019	discard	Wada fine u_offset=0.5897360	agent1	branch_search	0	-1.520844
exp502	4.37535640e-16	1.001296	1.000019	discard	Wada fine u_offset=0.5897380	agent1	branch_search	0	-1.520844
exp503	2.06774381e-16	1.001296	1.000019	discard	Wada fine u_offset=0.5897400	agent1	branch_search	0	-1.520844
exp504	3.77006140e-16	1.001296	-1.000019	discard	10^-8 resolution u_offset=0.58973400	agent1	branch_search	0	-1.520844
exp505	2.04903081e-16	1.001296	-1.000019	discard	10^-8 resolution u_offset=0.58973420	agent1	branch_search	0	-1.520844
exp506	1.96261557e-16	1.001296	-1.000019	discard	10^-8 resolution u_offset=0.58973440	agent1	branch_search	1	-1.520844
exp507	3.62021453e-16	1.001296	-1.000019	discard	10^-8 resolution u_offset=0.58973460	agent1	branch_search	0	-1.520844
exp508	4.00777441e-16	1.001296	1.000019	discard	10^-8 resolution u_offset=0.58973480	agent1	branch_search	1	-1.520844
exp509	3.74957179e-16	1.001296	1.000019	discard	10^-8 resolution u_offset=0.58973500	agent1	branch_search	0	-1.520844
exp510	3.06884301e-16	1.001296	1.000019	discard	10^-8 resolution u_offset=0.58973520	agent1	branch_search	0	-1.520844
exp511	4.99600361e-16	1.001296	1.000019	discard	10^-8 resolution u_offset=0.58973540	agent1	branch_search	1	-1.520844
exp512	2.06774381e-16	1.001296	1.000019	discard	10^-8 resolution u_offset=0.58973560	agent1	branch_search	0	-1.520844
exp513	1.88564362e-15	1.001296	1.000019	discard	10^-8 resolution u_offset=0.58973580	agent1	branch_search	0	-1.520844
exp514	3.52178773e-16	1.001296	1.000019	discard	10^-8 resolution u_offset=0.58973600	agent1	branch_search	1	-1.520844
exp515	3.62021453e-16	1.001296	-1.000019	discard	10^-9 resolution u_offset=0.589734600	agent1	branch_search	0	-1.520844
exp516	2.06774381e-16	1.001296	-1.000019	discard	10^-9 resolution u_offset=0.589734620	agent1	branch_search	1	-1.520844
exp517	3.96919288e-15	1.001296	-1.000019	discard	10^-9 resolution u_offset=0.589734640	agent1	branch_search	0	-1.520844
exp518	2.00532833e-15	1.001296	-1.000019	discard	10^-9 resolution u_offset=0.589734660	agent1	branch_search	0	-1.520844
exp519	2.02615702e-15	1.001296	-1.000019	discard	10^-9 resolution u_offset=0.589734680	agent1	branch_search	1	-1.520844
exp520	4.99600361e-16	1.001296	-1.000019	discard	10^-9 resolution u_offset=0.589734700	agent1	branch_search	0	-1.520844
exp521	2.14637385e-15	1.001296	-1.000019	discard	10^-9 resolution u_offset=0.589734720	agent1	branch_search	0	-1.520844
exp522	2.57581612e-16	1.001296	-1.000019	discard	10^-9 resolution u_offset=0.589734740	agent1	branch_search	0	-1.520844
exp523	2.57581612e-16	1.001296	1.000019	discard	10^-9 resolution u_offset=0.589734760	agent1	branch_search	0	-1.520844
exp524	1.96261557e-16	1.001296	1.000019	discard	10^-9 resolution u_offset=0.589734780	agent1	branch_search	1	-1.520844
exp525	4.00777441e-16	1.001296	1.000019	discard	10^-9 resolution u_offset=0.589734800	agent1	branch_search	0	-1.520844
exp526	2.02539645e-15	1.001296	1.000019	discard	boundary N=4 iter=1 u_offset=0.5900000	agent1	branch_search	0	-1.520844
exp527	2.04903081e-16	1.001296	-1.000019	discard	boundary N=4 iter=2 u_offset=0.5850000	agent1	branch_search	0	-1.520844
exp528	4.37535640e-16	1.001296	-1.000019	discard	boundary N=4 iter=3 u_offset=0.5875000	agent1	branch_search	1	-1.520844
exp529	3.62021453e-16	1.001296	-1.000019	discard	boundary N=4 iter=4 u_offset=0.5887500	agent1	branch_search	0	-1.520844
exp530	1.96261557e-16	1.001296	-1.000019	discard	boundary N=4 iter=5 u_offset=0.5893750	agent1	branch_search	0	-1.520844
exp531	2.06774381e-16	1.001296	-1.000019	discard	boundary N=4 iter=6 u_offset=0.5896875	agent1	branch_search	1	-1.520844
exp532	2.06774381e-16	1.001296	1.000019	discard	boundary N=4 iter=7 u_offset=0.5898438	agent1	branch_search	0	-1.520844
exp533	4.99600361e-16	1.001296	1.000019	discard	boundary N=4 iter=8 u_offset=0.5897657	agent1	branch_search	1	-1.520844
exp534	2.06774381e-16	1.001296	-1.000019	discard	boundary N=4 iter=9 u_offset=0.5897266	agent1	branch_search	0	-1.520844
exp535	2.06774381e-16	1.001296	1.000019	discard	boundary N=4 iter=10 u_offset=0.5897461	agent1	branch_search	0	-1.520844
exp536	2.37634737e-15	1.001296	1.000019	discard	boundary N=8 iter=1 u_offset=0.5900000	agent1	branch_search	1	-1.520844
exp537	9.19175793e-15	1.001296	-1.000019	discard	boundary N=8 iter=2 u_offset=0.5850000	agent1	branch_search	0	-1.520844
exp538	2.42560624e-15	1.001296	-1.000019	discard	boundary N=8 iter=3 u_offset=0.5875000	agent1	branch_search	0	-1.520844
exp539	9.25085906e-15	1.001296	-1.000019	discard	boundary N=8 iter=4 u_offset=0.5887500	agent1	branch_search	1	-1.520844
exp540	4.35928469e-15	1.001296	-1.000019	discard	boundary N=8 iter=5 u_offset=0.5893750	agent1	branch_search	0	-1.520844
exp541	2.75570013e-15	1.001296	-1.000019	discard	boundary N=8 iter=6 u_offset=0.5896875	agent1	branch_search	0	-1.520844
exp542	1.95383202e-15	1.001296	1.000019	discard	boundary N=8 iter=7 u_offset=0.5898438	agent1	branch_search	1	-1.520844
exp543	2.67074315e-15	1.001296	1.000019	discard	boundary N=8 iter=8 u_offset=0.5897657	agent1	branch_search	0	-1.520844
exp544	2.93380529e-15	1.001296	-1.000019	discard	boundary N=8 iter=9 u_offset=0.5897266	agent1	branch_search	1	-1.520844
exp545	1.96237217e-15	1.001296	1.000019	discard	boundary N=8 iter=10 u_offset=0.5897461	agent1	branch_search	0	-1.520844
exp546	7.01748895e-15	1.001296	1.000019	discard	boundary N=16 iter=1 u_offset=0.5900000	agent1	branch_search	1	-1.520844
