exp_id	residual	solution_norm	solution_mean	status	description	agent	design	elapsed_s	solution_energy
exp440	6.36262649e-17	0.998999	1.000000	discard	pos Ka=1.1e-5 v2	manual	spectral	1	-1.567655
exp441	6.36262649e-17	0.998999	1.000000	discard	pos Ka=1.1e-5 v3	manual	spectral	0	-1.567655
exp442	6.36262649e-17	0.998999	1.000000	discard	pos Ka=1.1e-5 v4	manual	spectral	0	-1.567655
exp443	6.36262649e-17	0.998999	1.000000	discard	pos Ka=1.1e-5 v5	manual	spectral	0	-1.567655
exp444	3.80565279e-16	1.001296	1.000019	discard	offset=1.000019	manual	spectral	0	-1.520844
exp445	2.06774381e-16	1.001296	1.000019	discard	offset=1.00002	manual	spectral	1	-1.520844
exp446	1.86448479e-16	1.001296	1.000019	discard	offset=1.0001	manual	spectral	0	-1.520844
exp447	2.06774381e-16	1.001296	1.000019	discard	offset=1.001	manual	spectral	0	-1.520844
exp448	2.57581612e-16	1.001296	1.000019	discard	pos n_mode=0 amp=0.0 4modes	myagent	spectral	0	-1.520844
exp449	2.06774381e-16	1.001296	1.000019	discard	pos n_mode=0 amp=0.001 4modes	myagent	spectral	1	-1.520844
exp450	2.06774381e-16	1.001296	1.000019	discard	pos n_mode=0 amp=0.005 4modes	myagent	spectral	0	-1.520844
exp451	2.57581612e-16	1.001296	1.000019	discard	pos n_mode=0 amp=0.01 4modes	myagent	spectral	0	-1.520844
exp452	6.69090738e-16	1.001296	1.000019	discard	pos n_mode=0 amp=0.02 4modes	myagent	spectral	0	-1.520844
exp453	6.36262649e-17	0.998999	-1.000000	discard	neg Ka=1.1e-5	manual	spectral	1	-1.567655
exp454	0.00000000e+00	1.139035	1.140175	discard	K_frequency=0 constant K pos branch u=sqrt(1.3)	opus	spectral	0	-1.426566
exp455	crash	0	0	crash	scipy nodes=300 tol=1e-14	myagent	spectral	0	0
exp456	1.41122274e-16	0.998999	1.000000	discard	pos Ka=1.09e-5 fine	manual	spectral	0	-1.567655
exp457	crash	0	0	crash	scipy nodes=500 tol=1e-14	myagent	spectral	0	0
exp458	2.98293310e-16	0.998999	1.000000	discard	pos Ka=1.095e-5 fine	manual	spectral	0	-1.567655
exp459	crash	0	0	crash	scipy nodes=1000 tol=1e-14	myagent	spectral	0	0
exp460	1.34544241e-16	0.998999	1.000000	discard	pos Ka=1.099e-5 fine	manual	spectral	1	-1.567655
exp461	crash	0	0	crash	scipy nodes=2000 tol=1e-14	myagent	spectral	1	0
exp462	4.13977936e-16	0.998999	1.000000	discard	pos Ka=1.101e-5 fine	manual	spectral	0	-1.567655
exp463	2.93896119e-16	0.998999	1.000000	discard	pos Ka=1.105e-5 fine	manual	spectral	0	-1.567655
exp464	4.47267437e-16	0.998999	1.000000	discard	pos Ka=1.11e-5 fine	manual	spectral	0	-1.567655
exp465	2.57581612e-16	1.001296	1.000019	discard	nm=2 amp=0.16	manual	spectral	0	-1.520844
exp466	3.62021453e-16	1.001296	1.000019	discard	nm=2 amp=0.19	manual	spectral	0	-1.520844
exp467	3.06884301e-16	1.001296	1.000019	discard	nm=2 amp=0.22	manual	spectral	1	-1.520844
exp468	1.96261557e-16	1.001296	1.000019	discard	nm=3 amp=0.16	manual	spectral	0	-1.520844
exp469	4.37535640e-16	1.001296	1.000019	discard	nm=3 amp=0.19	manual	spectral	0	-1.520844
exp470	3.62021453e-16	1.001296	1.000019	discard	nm=3 amp=0.22	manual	spectral	0	-1.520844
exp471	1.45910730e-16	0.998999	1.000000	discard	pos Ka=3e-5 sweep2	manual	spectral	0	-1.567655
exp472	2.94143877e-16	0.998999	1.000000	discard	pos Ka=4e-5 sweep2	manual	spectral	0	-1.567655
exp473	1.68129162e-16	0.998999	1.000000	discard	pos Ka=5e-5 sweep2	manual	spectral	0	-1.567655
exp474	4.90835189e-16	0.998999	1.000000	discard	pos Ka=6e-5 sweep2	manual	spectral	1	-1.567655
exp475	2.57252591e-16	0.998999	1.000000	discard	pos Ka=7e-5 sweep2	manual	spectral	0	-1.567655
exp476	1.53446222e-16	0.998999	1.000000	discard	pos Ka=8e-5 sweep2	manual	spectral	0	-1.567655
exp477	4.57515552e-16	0.998999	1.000000	discard	pos Ka=9e-5 sweep2	manual	spectral	0	-1.567655
exp478	1.20982795e-16	0.998999	1.000000	discard	pos Ka=3e-6 sweep2	manual	spectral	1	-1.567655
exp479	9.58675884e-17	0.998999	1.000000	discard	pos Ka=4e-6 sweep2	manual	spectral	0	-1.567655
exp480	5.19537373e-16	1.000987	1.000014	discard	K_amp=0.28	manual	spectral	0	-1.526857
exp481	crash	0	0	crash	K_amp=0.29	manual	spectral	0	0
exp482	crash	0	0	crash	K_amp=0.295	manual	spectral	0	0
exp483	1.86448479e-16	1.001296	1.000019	discard	K_amp=0.3	manual	spectral	1	-1.520844
exp484	5.54069701e-16	1.001376	1.000020	discard	K_amp=0.305	manual	spectral	0	-1.519277
exp485	4.93003407e-16	1.001459	1.000021	discard	K_amp=0.31	manual	spectral	0	-1.517684
exp486	crash	0	0	crash	K_amp=0.32	manual	spectral	0	0
exp487	2.00148302e-16	1.001298	-1.000025	discard	neg grid modes=2 amp=0.05	myagent	spectral	0	-1.520921
exp488	3.72380123e-16	1.001298	-1.000025	discard	neg grid modes=2 amp=0.10	myagent	spectral	1	-1.520921
exp489	2.00148302e-16	1.001298	-1.000025	discard	neg grid modes=2 amp=0.12	myagent	spectral	0	-1.520921
exp490	2.00148302e-16	1.001298	-1.000025	discard	neg grid modes=2 amp=0.14	myagent	spectral	0	-1.520921
exp491	8.77708367e-17	0.998999	1.000000	discard	pos modes=2 Ka=1.1e-5	manual	spectral	0	-1.567655
exp492	2.00148302e-16	1.001298	-1.000025	discard	neg grid modes=2 amp=0.15	myagent	spectral	0	-1.520921
exp493	1.91402846e-16	0.998999	1.000000	discard	pos modes=3 Ka=1.1e-5	manual	spectral	0	-1.567655
exp494	3.72380123e-16	1.001298	-1.000025	discard	neg grid modes=2 amp=0.16	myagent	spectral	1	-1.520921
exp495	6.71403430e-16	0.998999	1.000000	discard	pos modes=5 Ka=1.1e-5	manual	spectral	0	-1.567655
exp496	7.21644966e-16	1.001298	-1.000025	discard	neg grid modes=2 amp=0.17	myagent	spectral	0	-1.520921
exp497	3.07735090e-16	0.998999	1.000000	discard	pos modes=6 Ka=1.1e-5	manual	spectral	0	-1.567655
exp498	2.00148302e-16	1.001298	-1.000025	discard	neg grid modes=2 amp=0.174	myagent	spectral	0	-1.520921
exp499	3.72380123e-16	1.001298	-1.000025	discard	neg grid modes=2 amp=0.18	myagent	spectral	0	-1.520921
exp500	2.00148302e-16	1.001298	-1.000025	discard	neg grid modes=2 amp=0.19	myagent	spectral	1	-1.520921
exp501	2.00148302e-16	1.001298	-1.000025	discard	neg grid modes=2 amp=0.20	myagent	spectral	0	-1.520921
exp502	2.12761318e-16	1.001296	-1.000019	discard	neg grid modes=3 amp=0.05	myagent	spectral	0	-1.520844
exp503	5.20532678e-16	1.001296	-1.000019	discard	neg grid modes=3 amp=0.10	myagent	spectral	0	-1.520844
exp504	1.84479774e-16	1.001296	-1.000019	discard	neg grid modes=3 amp=0.12	myagent	spectral	1	-1.520844
exp505	6.06290198e-16	1.001296	-1.000019	discard	neg grid modes=3 amp=0.14	myagent	spectral	0	-1.520844
exp506	4.37471443e-16	1.001296	-1.000019	discard	neg grid modes=3 amp=0.15	myagent	spectral	0	-1.520844
exp507	4.37471443e-16	1.001296	-1.000019	discard	neg grid modes=3 amp=0.16	myagent	spectral	0	-1.520844
exp508	2.12761318e-16	1.001296	-1.000019	discard	neg grid modes=3 amp=0.17	myagent	spectral	1	-1.520844
exp509	4.22769823e-16	1.001296	-1.000019	discard	neg grid modes=3 amp=0.174	myagent	spectral	0	-1.520844
exp510	4.46108463e-16	1.001296	-1.000019	discard	neg grid modes=3 amp=0.18	myagent	spectral	0	-1.520844
exp511	1.84479774e-16	1.001296	-1.000019	discard	neg grid modes=3 amp=0.19	myagent	spectral	1	-1.520844
exp512	4.37471443e-16	1.001296	-1.000019	discard	neg grid modes=3 amp=0.20	myagent	spectral	0	-1.520844
exp513	2.57581612e-16	1.001296	-1.000019	discard	neg grid modes=4 amp=0.05	myagent	spectral	0	-1.520844
exp514	3.62021453e-16	1.001296	-1.000019	discard	neg grid modes=4 amp=0.10	myagent	spectral	0	-1.520844
exp515	1.96261557e-16	1.001296	-1.000019	discard	neg grid modes=4 amp=0.12	myagent	spectral	1	-1.520844
exp516	2.06774381e-16	1.001296	-1.000019	discard	neg grid modes=4 amp=0.14	myagent	spectral	0	-1.520844
exp517	2.06774381e-16	1.001296	-1.000019	discard	neg grid modes=4 amp=0.15	myagent	spectral	0	-1.520844
exp518	1.86448479e-16	1.001296	-1.000019	discard	neg grid modes=4 amp=0.16	myagent	spectral	0	-1.520844
exp519	3.15548060e-16	1.001296	-1.000019	discard	neg grid modes=4 amp=0.17	myagent	spectral	1	-1.520844
exp520	3.62021453e-16	1.001296	-1.000019	discard	neg grid modes=4 amp=0.174	myagent	spectral	0	-1.520844
exp521	1.96261557e-16	1.001296	-1.000019	discard	neg grid modes=4 amp=0.18	myagent	spectral	0	-1.520844
exp522	3.62021453e-16	1.001296	-1.000019	discard	neg grid modes=4 amp=0.19	myagent	spectral	0	-1.520844
exp523	3.34221389e-16	1.001296	-1.000019	discard	neg grid modes=4 amp=0.20	myagent	spectral	1	-1.520844
exp524	crash	0	0	crash	neg grid modes=5 amp=0.05	myagent	spectral	0	0
exp525	1.51078911e-16	0.998999	1.000000	discard	K_amp=1e-10	manual	spectral	0	-1.567655
exp526	crash	0	0	crash	neg grid modes=5 amp=0.10	myagent	spectral	0	0
exp527	2.05514250e-16	0.998999	1.000000	discard	K_amp=1e-8	manual	spectral	0	-1.567655
exp528	crash	0	0	crash	neg grid modes=5 amp=0.12	myagent	spectral	1	0
exp529	1.24411619e-16	0.998999	1.000000	discard	K_amp=1e-6	manual	spectral	1	-1.567655
exp530	7.06541606e-16	1.001384	1.001866	discard	K_frequency=2 pos 4 modes	opus	spectral	0	-1.544075
exp531	crash	0	0	crash	neg grid modes=5 amp=0.14	myagent	spectral	0	0
exp532	1.92540185e-16	0.998999	1.000000	discard	K_amp=1e-4	manual	spectral	0	-1.567655
exp533	crash	0	0	crash	neg grid modes=5 amp=0.15	myagent	spectral	0	0
exp534	5.04552525e-16	0.998999	1.000000	discard	pos amp=0.01 Ka=1.1e-5	manual	spectral	0	-1.567654
exp535	5.04552525e-16	0.998999	1.000000	discard	K_amp=1e-3	manual	spectral	0	-1.567654
exp536	crash	0	0	crash	neg grid modes=5 amp=0.16	myagent	spectral	0	0
exp537	3.33333898e-16	0.998996	1.000000	discard	pos amp=0.02 Ka=1.1e-5	manual	spectral	0	-1.567603
exp538	3.33333898e-16	0.998996	1.000000	discard	K_amp=1e-2	manual	spectral	0	-1.567603
exp539	4.23698885e-16	1.001296	-1.000019	discard	neg grid modes=5 amp=0.17	myagent	spectral	0	-1.520844
exp540	3.16143280e-16	0.998999	1.000000	discard	pos amp=0.03 Ka=1.1e-5	manual	spectral	1	-1.567655
exp541	crash	0	0	crash	neg grid modes=5 amp=0.174	myagent	spectral	0	0
exp542	4.22961834e-16	0.998999	1.000000	discard	pos amp=0.05 Ka=1.1e-5	manual	spectral	0	-1.567655
exp543	crash	0	0	crash	neg grid modes=5 amp=0.18	myagent	spectral	0	0
exp544	4.89097278e-16	1.001296	-1.000019	discard	neg grid modes=5 amp=0.19	myagent	spectral	0	-1.520844
exp545	crash	0	0	crash	neg grid modes=5 amp=0.20	myagent	spectral	0	0
exp546	crash	0	0	crash	neg grid modes=6 amp=0.05	myagent	spectral	1	0
exp547	crash	0	0	crash	neg grid modes=6 amp=0.10	myagent	spectral	0	0
exp548	crash	0	0	crash	neg grid modes=6 amp=0.12	myagent	spectral	0	0
exp549	crash	0	0	crash	neg grid modes=6 amp=0.14	myagent	spectral	0	0
exp550	crash	0	0	crash	neg grid modes=6 amp=0.15	myagent	spectral	1	0
exp551	crash	0	0	crash	neg grid modes=6 amp=0.16	myagent	spectral	0	0
exp552	crash	0	0	crash	neg grid modes=6 amp=0.17	myagent	spectral	0	0
exp553	crash	0	0	crash	neg grid modes=6 amp=0.174	myagent	spectral	0	0
exp554	crash	0	0	crash	neg grid modes=6 amp=0.18	myagent	spectral	0	0
exp555	crash	0	0	crash	neg grid modes=6 amp=0.19	myagent	spectral	1	0
exp556	crash	0	0	crash	neg grid modes=6 amp=0.20	myagent	spectral	0	0
exp557	crash	0	0	crash	neg grid modes=7 amp=0.05	myagent	spectral	0	0
exp558	crash	0	0	crash	neg grid modes=7 amp=0.10	myagent	spectral	0	0
exp559	crash	0	0	crash	neg grid modes=7 amp=0.12	myagent	spectral	1	0
exp560	crash	0	0	crash	neg grid modes=7 amp=0.14	myagent	spectral	0	0
exp561	crash	0	0	crash	neg grid modes=7 amp=0.15	myagent	spectral	0	0
exp562	crash	0	0	crash	neg grid modes=7 amp=0.16	myagent	spectral	0	0
exp563	crash	0	0	crash	neg grid modes=7 amp=0.17	myagent	spectral	0	0
exp564	crash	0	0	crash	neg grid modes=7 amp=0.174	myagent	spectral	0	0
exp565	crash	0	0	crash	neg grid modes=7 amp=0.18	myagent	spectral	0	0
exp566	crash	0	0	crash	neg grid modes=7 amp=0.19	myagent	spectral	0	0
exp567	crash	0	0	crash	neg grid modes=7 amp=0.20	myagent	spectral	0	0
exp568	1.68166828e-16	0.998999	1.000000	discard	K_amp=2e-7	manual	spectral	0	-1.567655
exp569	1.28992787e-16	0.998999	1.000000	discard	pos Ka=1e-7	manual	spectral	0	-1.567655
exp570	1.03320243e-16	0.998999	1.000000	discard	K_amp=5e-7	manual	spectral	0	-1.567655
exp571	1.24411619e-16	0.998999	1.000000	discard	pos Ka=5e-7	manual	spectral	0	-1.567655
exp572	3.50747424e-16	0.998999	1.000000	discard	K_amp=1e-6	manual	spectral	0	-1.567655
exp573	1.99516962e-16	0.998999	1.000000	discard	pos Ka=1e-8	manual	spectral	0	-1.567655
exp574	5.74849950e-16	0.998999	1.000000	discard	K_amp=2e-6	manual	spectral	1	-1.567655
exp575	2.62457368e-16	0.998999	1.000000	discard	pos Ka=5e-8	manual	spectral	1	-1.567655
exp576	1.09299507e-16	0.998999	1.000000	discard	K_amp=5e-6	manual	spectral	0	-1.567655
exp577	2.56190443e-16	0.998999	1.000000	discard	pos Ka=1e-9	manual	spectral	0	-1.567655
exp578	2.56190443e-16	0.998999	1.000000	discard	K_amp=1e-5	manual	spectral	0	-1.567655
exp579	1.84479774e-16	1.001296	-1.000019	discard	verify neg 3modes amp=0.12	myagent	spectral	0	-1.520844
exp580	1.84479774e-16	1.001296	-1.000019	discard	verify neg 3modes amp=0.12	myagent	spectral	0	-1.520844
exp581	1.84479774e-16	1.001296	-1.000019	discard	verify neg 3modes amp=0.12	myagent	spectral	0	-1.520844
exp582	4.45865556e-16	1.001296	1.000019	discard	pos 3modes amp=0.08	myagent	spectral	1	-1.520844
exp583	4.37471443e-16	1.001296	1.000019	discard	pos 3modes amp=0.10	myagent	spectral	0	-1.520844
exp584	2.22892279e-16	1.001296	1.000019	discard	pos 3modes amp=0.12	myagent	spectral	0	-1.520844
exp585	4.37471443e-16	1.001296	1.000019	discard	pos 3modes amp=0.14	myagent	spectral	0	-1.520844
exp586	5.20532678e-16	1.001296	1.000019	discard	pos 3modes amp=0.15	myagent	spectral	1	-1.520844
exp587	4.37471443e-16	1.001296	1.000019	discard	pos 3modes amp=0.16	myagent	spectral	0	-1.520844
exp588	1.84479774e-16	1.001296	1.000019	discard	pos 3modes amp=0.17	myagent	spectral	0	-1.520844
exp589	2.12761318e-16	1.001296	1.000019	discard	pos 3modes amp=0.18	myagent	spectral	0	-1.520844
exp590	4.22769823e-16	1.001296	1.000019	discard	pos 3modes amp=0.20	myagent	spectral	1	-1.520844
exp591	1.28992787e-16	0.998999	1.000000	discard	verify K_amp=5e-7	manual	spectral	0	-1.567655
exp592	0.00000000e+00	0.998999	1.000000	discard	modes=1 Ka=0	manual	spectral	0	-1.567655
exp593	2.12761318e-16	1.001296	1.000019	discard	pos 3modes fine amp=0.165	myagent	spectral	0	-1.520844
exp594	1.24126708e-16	0.998999	1.000000	discard	modes=1 Ka=1.1e-5	manual	spectral	0	-1.567655
exp595	4.46108463e-16	1.001296	1.000019	discard	pos 3modes fine amp=0.168	myagent	spectral	1	-1.520844
exp596	0.00000000e+00	0.998999	1.000000	discard	modes=2 Ka=0	manual	spectral	0	-1.567655
exp597	1.84479774e-16	1.001296	1.000019	discard	pos 3modes fine amp=0.170	myagent	spectral	0	-1.520844
exp598	8.77708367e-17	0.998999	1.000000	discard	modes=2 Ka=1.1e-5	manual	spectral	0	-1.567655
exp599	4.37471443e-16	1.001296	1.000019	discard	pos 3modes fine amp=0.172	myagent	spectral	0	-1.520844
exp600	4.56009058e-16	1.001296	1.000019	discard	pos 3modes fine amp=0.174	myagent	spectral	0	-1.520844
exp601	5.20532678e-16	1.001296	1.000019	discard	pos 3modes fine amp=0.176	myagent	spectral	1	-1.520844
exp602	1.84479774e-16	1.001296	1.000019	discard	pos 3modes fine amp=0.178	myagent	spectral	0	-1.520844
exp603	2.12761318e-16	1.001296	1.000019	discard	pos 3modes fine amp=0.180	myagent	spectral	0	-1.520844
exp604	4.17187647e-16	0.998999	1.000000	discard	pos Ka=-1.1e-5	manual	spectral	1	-1.567655
exp605	4.17187647e-16	0.998999	1.000000	discard	K_amp=3e-7	manual	spectral	0	-1.567655
exp606	1.23120266e-16	0.998999	1.000000	discard	pos Ka=-1e-5	manual	spectral	0	-1.567655
exp607	1.23120266e-16	0.998999	1.000000	discard	K_amp=4e-7	manual	spectral	0	-1.567655
exp608	1.28992787e-16	0.998999	1.000000	discard	K_amp=5e-7	manual	spectral	0	-1.567655
exp608	1.28992787e-16	0.998999	1.000000	discard	pos Ka=-5e-6	manual	spectral	0	-1.567655
exp609	2.00148302e-16	1.001298	1.000025	discard	pos 2modes amp=0.05	myagent	spectral	0	-1.520921
exp610	3.14898828e-16	0.998999	1.000000	discard	K_amp=6e-7	manual	spectral	0	-1.567655
exp611	3.72380123e-16	1.001298	1.000025	discard	pos 2modes amp=0.08	myagent	spectral	0	-1.520921
exp612	2.20598109e-16	0.998999	1.000000	discard	K_amp=7e-7	manual	spectral	1	-1.567655
exp613	2.00148302e-16	1.001298	1.000025	discard	pos 2modes amp=0.10	myagent	spectral	0	-1.520921
exp614	3.41299296e-16	0.998999	1.000000	discard	K_amp=8e-7	manual	spectral	0	-1.567655
exp615	2.00148302e-16	1.001298	1.000025	discard	pos 2modes amp=0.12	myagent	spectral	0	-1.520921
exp616	2.22112866e-16	0.998999	1.000000	discard	K_amp=9e-7	manual	spectral	0	-1.567655
exp617	2.00148302e-16	1.001298	1.000025	discard	pos 2modes amp=0.14	myagent	spectral	0	-1.520921
exp618	2.00148302e-16	1.001298	1.000025	discard	pos 2modes amp=0.15	myagent	spectral	0	-1.520921
exp619	2.00148302e-16	1.001298	1.000025	discard	pos 2modes amp=0.16	myagent	spectral	1	-1.520921
exp620	2.00148302e-16	1.001298	1.000025	discard	pos 2modes amp=0.17	myagent	spectral	0	-1.520921
exp621	3.72380123e-16	1.001298	1.000025	discard	pos 2modes amp=0.18	myagent	spectral	0	-1.520921
exp622	2.00148302e-16	1.001298	1.000025	discard	pos 2modes amp=0.20	myagent	spectral	0	-1.520921
exp623	2.00148302e-16	1.001298	1.000025	discard	pos 2modes amp=0.25	myagent	spectral	1	-1.520921
exp624	2.00148302e-16	1.001298	1.000025	discard	pos 2modes amp=0.30	myagent	spectral	0	-1.520921
exp625	0.00000000e+00	1.139035	-1.140175	discard	K_frequency=0 neg branch u=-sqrt(1.3)	opus	spectral	0	-1.426566
exp626	2.00148302e-16	1.001298	-1.000025	discard	neg 2modes amp=0.05	myagent	spectral	0	-1.520921
exp627	2.51337427e-16	1.001298	-1.000025	discard	neg 2modes amp=0.08	myagent	spectral	0	-1.520921
exp628	3.72380123e-16	1.001298	-1.000025	discard	neg 2modes amp=0.10	myagent	spectral	1	-1.520921
exp629	2.00148302e-16	1.001298	-1.000025	discard	neg 2modes amp=0.12	myagent	spectral	0	-1.520921
exp630	2.00148302e-16	1.001298	-1.000025	discard	neg 2modes amp=0.14	myagent	spectral	0	-1.520921
exp631	2.00148302e-16	1.001298	-1.000025	discard	neg 2modes amp=0.15	myagent	spectral	0	-1.520921
exp632	3.72380123e-16	1.001298	-1.000025	discard	neg 2modes amp=0.16	myagent	spectral	1	-1.520921
exp633	7.21644966e-16	1.001298	-1.000025	discard	neg 2modes amp=0.17	myagent	spectral	0	-1.520921
exp634	3.72380123e-16	1.001298	-1.000025	discard	neg 2modes amp=0.18	myagent	spectral	0	-1.520921
exp635	2.00148302e-16	1.001298	-1.000025	discard	neg 2modes amp=0.20	myagent	spectral	0	-1.520921
exp636	2.00148302e-16	1.001298	-1.000025	discard	neg 2modes amp=0.25	myagent	spectral	1	-1.520921
exp637	2.00148302e-16	1.001298	-1.000025	discard	neg 2modes amp=0.30	myagent	spectral	0	-1.520921
exp638	4.72244806e-16	0.998999	1.000000	discard	K_amp=3.5e-7	manual	spectral	0	-1.567655
exp639	1.23120266e-16	0.998999	1.000000	discard	K_amp=4.0e-7	manual	spectral	0	-1.567655
exp640	3.57340309e-16	0.998999	1.000000	discard	K_amp=4.5e-7	manual	spectral	0	-1.567655
exp641	6.36262649e-17	0.998999	1.000000	discard	pos Ka=1.1e-5 ultrafine	manual	spectral	0	-1.567655
exp642	6.36262649e-17	0.998999	1.000000	discard	pos Ka=1.10e-5 ultrafine	manual	spectral	1	-1.567655
exp643	6.36262649e-17	0.998999	1.000000	discard	pos Ka=1.100e-5 ultrafine	manual	spectral	0	-1.567655
exp644	6.36262649e-17	0.998999	1.000000	discard	pos Ka=1.1000e-5 ultrafine	manual	spectral	0	-1.567655
exp645	2.28903589e-16	0.998999	1.000000	discard	pos Ka=1.10001e-5 ultrafine	manual	spectral	0	-1.567655
exp646	3.35094738e-16	0.998999	1.000000	discard	pos Ka=1.10002e-5 ultrafine	manual	spectral	1	-1.567655
exp647	1.93392340e-16	0.998999	1.000000	discard	pos Ka=1.09999e-5 ultrafine	manual	spectral	0	-1.567655
exp648	3.27085567e-16	0.998999	1.000000	discard	pos Ka=1.09998e-5 ultrafine	manual	spectral	0	-1.567655
exp649	5.11787527e-16	1.001322	1.000049	discard	pos 1mode amp=0.10	myagent	spectral	1	-1.520921
exp650	5.55111512e-17	1.001322	1.000049	discard	pos 1mode amp=0.15	myagent	spectral	0	-1.520921
exp651	1.23120266e-16	0.998999	1.000000	discard	K_amp=4e-7 amp=0.1	manual	spectral	0	-1.567655
exp652	6.13140706e-16	1.001322	1.000049	discard	pos 1mode amp=0.17	myagent	spectral	0	-1.520921
exp653	2.45134363e-16	0.998999	1.000000	discard	K_amp=4e-7 amp=0.15	manual	spectral	0	-1.567655
exp654	5.55111512e-17	1.001322	1.000049	discard	pos 1mode amp=0.20	myagent	spectral	0	-1.520921
exp654	1.23120266e-16	0.998999	1.000000	discard	K_amp=4e-7 amp=0.19	manual	spectral	0	-1.567655
exp655	5.71522282e-16	1.001322	1.000049	discard	pos 1mode amp=0.30	myagent	spectral	1	-1.520921
exp656	1.93970964e-16	0.998999	1.000000	discard	K_amp=4e-7 amp=0.22	manual	spectral	1	-1.567655
exp657	1.23120266e-16	0.998999	1.000000	discard	K_amp=4e-7 amp=0.5	manual	spectral	0	-1.567655
exp658	4.99889398e-16	1.001731	1.000300	discard	multipole K_mode K_freq=2 pos 4 modes	opus	spectral	0	-1.512717
exp659	1.25308452e-16	0.998999	1.000000	discard	scan Ka=1.0000000e-06	manual	spectral	0	-1.567655
exp660	2.53894479e-16	0.998999	-1.000000	discard	scan Ka=2.0000000e-06	manual	spectral	0	-1.567655
exp661	2.53894479e-16	0.998999	-1.000000	discard	neg K_amp=4e-7	manual	spectral	0	-1.567655
exp662	1.20982795e-16	0.998999	1.000000	discard	scan Ka=3.0000000e-06	manual	spectral	0	-1.567655
exp663	9.58675884e-17	0.998999	1.000000	discard	scan Ka=4.0000000e-06	manual	spectral	0	-1.567655
exp664	2.62457368e-16	0.998999	1.000000	discard	scan Ka=5.0000000e-06	manual	spectral	0	-1.567655
exp665	4.13092483e-16	0.998999	1.000000	discard	scan Ka=6.0000000e-06	manual	spectral	0	-1.567655
exp666	3.29654616e-16	0.998999	1.000000	discard	scan Ka=7.0000000e-06	manual	spectral	0	-1.567655
exp667	2.65468770e-16	0.998999	1.000000	discard	scan Ka=8.0000000e-06	manual	spectral	0	-1.567655
exp668	1.34467266e-16	0.998999	1.000000	discard	scan Ka=9.0000000e-06	manual	spectral	0	-1.567655
exp669	8.78610160e-17	0.998999	1.000000	discard	scan Ka=1.0000000e-05	manual	spectral	0	-1.567655
exp670	6.36262649e-17	0.998999	1.000000	discard	scan Ka=1.1000000e-05	manual	spectral	0	-1.567655
exp671	4.80687570e-16	0.998999	1.000000	discard	scan Ka=1.2000000e-05	manual	spectral	0	-1.567655
exp672	1.68182148e-16	0.998999	1.000000	discard	scan Ka=1.3000000e-05	manual	spectral	0	-1.567655
exp673	2.60347437e-16	0.998999	1.000000	discard	scan Ka=1.4000000e-05	manual	spectral	0	-1.567655
