exp_id	residual	solution_norm	solution_mean	status	description	agent	design	elapsed_s	solution_energy
exp905	0.00000000e+00	0.998999	1.000000	discard	sine freq=3 1mode	myagent	spectral	0	-1.567655
exp906	5.55111512e-17	1.004455	1.000245	discard	multipole freq=1 1mode	myagent	spectral	0	-1.463207
exp906	1.24126708e-16	1.003485	1.000170	discard	Ka scan	manual	spectral	0	-1.480774
exp907	1.24126708e-16	1.003718	1.000187	discard	Ka scan	manual	spectral	1	-1.476529
exp907	2.77555756e-16	1.072772	1.071841	discard	multipole freq=2 1mode	myagent	spectral	1	-1.482009
exp908	5.55111512e-17	1.004455	1.000245	discard	multipole freq=3 1mode	myagent	spectral	0	-1.463207
exp908	4.04127281e-16	1.003957	1.000205	discard	Ka scan	manual	spectral	0	-1.472186
exp909	2.00148302e-16	1.004203	1.000225	discard	Ka scan	manual	spectral	0	-1.467746
exp910	5.55111512e-17	1.004455	1.000245	discard	Ka scan	manual	spectral	0	-1.463207
exp911	1.24126708e-16	1.004714	1.000268	discard	Ka scan	manual	spectral	1	-1.458572
exp912	1.75541673e-16	1.004978	1.000291	discard	Ka scan	manual	spectral	0	-1.453840
exp913	6.98867537e-16	1.005249	1.000316	discard	Ka scan	manual	spectral	0	-1.449011
exp914	2.98936698e-16	1.005527	1.000343	discard	Ka scan	manual	spectral	0	-1.444086
exp915	3.14018492e-16	1.005811	1.000371	discard	Ka scan	manual	spectral	1	-1.439065
exp916	3.92523115e-17	1.006102	1.000401	discard	Ka scan	manual	spectral	0	-1.433948
exp917	5.55111512e-17	1.006398	1.000433	discard	Ka scan	manual	spectral	0	-1.428736
exp918	1.24126708e-16	1.006702	1.000466	discard	modes=1 K_amp=0.3 FINAL	manual	spectral	0	-1.423429
exp919	1.24126708e-16	1.006702	1.000466	discard	Ka scan	manual	spectral	0	-1.423429
exp920	1.24126708e-16	1.007012	1.000502	discard	Ka scan	manual	spectral	1	-1.418028
exp921	1.75541673e-16	1.007329	1.000539	discard	Ka scan	manual	spectral	0	-1.412532
exp922	2.74766180e-16	1.007652	1.000578	discard	Ka scan	manual	spectral	0	-1.406942
exp923	3.92523115e-17	1.007982	1.000619	discard	Ka scan	manual	spectral	0	-1.401258
exp924	1.17756934e-16	1.008318	1.000663	discard	Ka scan	manual	spectral	1	-1.395482
exp925	1.41526222e-16	1.008662	1.000708	discard	Ka scan	manual	spectral	0	-1.389612
exp926	7.85046229e-17	1.009012	1.000756	discard	Ka scan	manual	spectral	0	-1.383649
exp927	2.51337427e-16	1.009368	1.000806	discard	Ka scan	manual	spectral	0	-1.377594
exp928	4.77524979e-16	1.009732	1.000859	discard	Ka scan	manual	spectral	1	-1.371448
exp929	3.92523115e-17	1.010102	1.000914	discard	Ka scan	manual	spectral	0	-1.365209
exp930	5.55111512e-17	1.010479	1.000971	discard	Ka scan	manual	spectral	0	-1.358880
exp931	3.14018492e-16	1.010863	1.001031	discard	Ka scan	manual	spectral	0	-1.352459
exp932	1.57009246e-16	1.011254	1.001093	discard	Ka scan	manual	spectral	1	-1.345948
exp933	1.96261557e-16	1.011652	1.001158	discard	Ka scan	manual	spectral	0	-1.339347
exp934	3.42756075e-16	1.012057	1.001226	discard	Ka scan	manual	spectral	0	-1.332656
exp935	4.59855529e-16	1.012469	1.001297	discard	Ka scan	manual	spectral	0	-1.325876
exp936	1.75541673e-16	1.012888	1.001371	discard	Ka scan	manual	spectral	1	-1.319007
exp937	3.14631211e-16	1.013313	1.001447	discard	Ka scan	manual	spectral	0	-1.312048
exp938	1.75541673e-16	1.013746	1.001527	discard	Ka scan	manual	spectral	0	-1.305002
exp939	9.81307787e-17	1.014186	1.001610	discard	Ka scan	manual	spectral	0	-1.297867
exp940	3.16462252e-16	1.014633	1.001695	discard	Ka scan	manual	spectral	1	-1.290645
exp941	1.97240424e-16	1.015087	1.001784	discard	Ka scan	manual	spectral	0	-1.283336
exp942	3.14631211e-16	1.015548	1.001877	discard	Ka scan	manual	spectral	0	-1.275939
exp943	3.16462252e-16	1.016016	1.001972	discard	Ka scan	manual	spectral	0	-1.268456
exp944	5.90091632e-16	1.016491	1.002071	discard	Ka scan	manual	spectral	1	-1.260887
exp945	1.11022302e-16	1.016974	1.002174	discard	Ka scan	manual	spectral	0	-1.253232
exp946	3.55444798e-16	1.017463	1.002279	discard	Ka scan	manual	spectral	0	-1.245492
exp947	4.33555951e-16	1.017960	1.002389	discard	Ka scan	manual	spectral	0	-1.237666
exp948	3.14018492e-16	1.018464	1.002502	discard	Ka scan	manual	spectral	1	-1.229755
exp949	5.16283550e-16	1.018976	1.002619	discard	Ka scan	manual	spectral	0	-1.221761
exp950	2.00148302e-16	1.019494	1.002739	discard	Ka scan	manual	spectral	0	-1.213682
exp951	5.55111512e-17	1.020020	1.002864	discard	Ka scan	manual	spectral	0	-1.205519
exp952	2.35513869e-16	1.020553	1.002992	discard	Ka scan	manual	spectral	1	-1.197273
exp953	2.85761141e-16	1.021093	1.003124	discard	Ka scan	manual	spectral	0	-1.188944
exp954	4.77524979e-16	1.021641	1.003260	discard	Ka scan	manual	spectral	0	-1.180532
exp955	1.57009246e-16	1.022195	1.003400	discard	Ka scan	manual	spectral	0	-1.172038
exp956	3.94480848e-16	1.022757	1.003544	discard	Ka scan	manual	spectral	1	-1.163462
exp957	1.11022302e-16	1.023327	1.003692	discard	Ka scan	manual	spectral	0	-1.154804
exp958	1.57009246e-16	1.023903	1.003845	discard	Ka scan	manual	spectral	0	-1.146064
exp959	4.33555951e-16	1.024487	1.004002	discard	Ka scan	manual	spectral	0	-1.137244
exp960	2.74766180e-16	1.025079	1.004163	discard	Ka scan	manual	spectral	0	-1.128343
exp961	1.61841426e-16	1.025677	1.004328	discard	Ka scan	manual	spectral	0	-1.119362
exp962	2.38762489e-16	1.026283	1.004498	discard	Ka scan	manual	spectral	0	-1.110300
exp963	4.77524979e-16	1.026896	1.004672	discard	Ka scan	manual	spectral	0	-1.101159
exp964	5.11787527e-16	1.027516	1.004851	discard	Ka scan	manual	spectral	1	-1.091938
exp965	2.74766180e-16	1.028144	1.005034	discard	Ka scan	manual	spectral	0	-1.082639
exp966	2.98936698e-16	1.028778	1.005222	discard	Ka scan	manual	spectral	0	-1.073260
exp967	1.75541673e-16	0.999878	1.000008	discard	Ka=0.19 branch	manual	spectral	0	-1.548847
exp968	1.24126708e-16	0.999878	-1.000008	discard	Ka=0.19 branch	manual	spectral	0	-1.548847
exp969	0.00000000e+00	0.000000	0.000000	discard	Ka=0.19 branch	manual	spectral	0	0.000000
exp970	5.55111512e-17	1.001322	1.000049	discard	modes=1 amp=0.01	manual	spectral	0	-1.520921
exp971	5.55111512e-17	1.001322	1.000049	discard	modes=1 amp=0.01	manual	spectral	0	-1.520921
exp972	5.55111512e-17	1.001322	1.000049	discard	modes=1 amp=0.05	manual	spectral	0	-1.520921
exp973	5.55111512e-17	1.001322	1.000049	discard	modes=1 amp=0.05	manual	spectral	1	-1.520921
exp974	5.11787527e-16	1.001322	1.000049	discard	modes=1 amp=0.1	manual	spectral	0	-1.520921
exp975	5.11787527e-16	1.001322	1.000049	discard	modes=1 amp=0.1	manual	spectral	0	-1.520921
exp976	5.55111512e-17	1.001322	1.000049	discard	modes=1 amp=0.12	manual	spectral	0	-1.520921
exp977	5.55111512e-17	1.001322	1.000049	discard	modes=1 amp=0.12	manual	spectral	0	-1.520921
exp978	5.55111512e-17	1.001322	1.000049	discard	modes=1 amp=0.14	manual	spectral	0	-1.520921
exp979	5.55111512e-17	1.001322	1.000049	discard	modes=1 amp=0.14	manual	spectral	0	-1.520921
exp980	5.55111512e-17	1.001322	1.000049	discard	modes=1 amp=0.15	manual	spectral	0	-1.520921
exp981	5.55111512e-17	1.001322	1.000049	discard	modes=1 amp=0.15	manual	spectral	0	-1.520921
exp982	5.55111512e-17	1.001322	1.000049	discard	modes=1 amp=0.16	manual	spectral	0	-1.520921
exp983	5.55111512e-17	1.001322	1.000049	discard	modes=1 amp=0.16	manual	spectral	0	-1.520921
exp984	5.55111512e-17	1.001322	1.000049	discard	modes=1 amp=0.18	manual	spectral	1	-1.520921
exp985	5.55111512e-17	1.001322	1.000049	discard	modes=1 amp=0.18	manual	spectral	0	-1.520921
exp986	5.55111512e-17	1.001322	1.000049	discard	modes=1 amp=0.2	manual	spectral	0	-1.520921
exp987	5.55111512e-17	1.001322	1.000049	discard	modes=1 amp=0.2	manual	spectral	0	-1.520921
exp988	5.71522282e-16	1.001322	1.000049	discard	modes=1 amp=0.3	manual	spectral	1	-1.520921
exp989	1.75541673e-16	0.999878	1.000008	discard	Ka=0.19 pos verify	manual	spectral	0	-1.548847
exp989	1.75541673e-16	0.999878	1.000008	discard	modes=1 amp=0.3	manual	spectral	0	-1.548847
exp990	5.55111512e-17	1.001322	1.000049	discard	Ka=0.19 pos verify	manual	spectral	0	-1.520921
exp990	5.55111512e-17	1.001322	1.000049	discard	modes=1 amp=0.5	manual	spectral	0	-1.520921
exp991	1.75541673e-16	0.999878	1.000008	discard	Ka=0.19 pos verify	manual	spectral	0	-1.548847
exp991	1.75541673e-16	0.999878	1.000008	discard	modes=1 amp=0.5	manual	spectral	0	-1.548847
exp992	5.55111512e-17	1.001322	-1.000049	discard	modes=1 neg K_amp=0.3	manual	spectral	0	-1.520921
exp993	0.00000000e+00	1.139035	1.140175	discard	1 mode K_frequency=0	manual	spectral	0	-1.426566
exp994	3.72380123e-16	0.999210	1.000001	discard	1mode Ka=0.1	myagent	spectral	1	-1.562436
exp995	1.24126708e-16	0.999525	1.000003	discard	1mode Ka=0.15	myagent	spectral	0	-1.555923
exp996	7.85046229e-17	0.999980	1.000010	discard	1mode Ka=0.2	myagent	spectral	0	-1.546820
exp997	2.48253415e-16	1.000579	1.000024	discard	1mode Ka=0.25	myagent	spectral	1	-1.535146
exp998	7.85046229e-17	1.001007	1.000037	discard	1mode Ka=0.28	myagent	spectral	0	-1.526916
exp999	2.00148302e-16	1.001162	1.000043	discard	1mode Ka=0.29	myagent	spectral	0	-1.523969
exp1000	5.55111512e-17	1.001322	1.000049	discard	1mode Ka=0.30	myagent	spectral	0	-1.520921
exp1001	0.00000000e+00	1.001489	1.000056	discard	1mode Ka=0.31	myagent	spectral	1	-1.517772
exp1002	5.55111512e-17	1.001661	1.000064	discard	1mode Ka=0.32	myagent	spectral	0	-1.514522
exp1003	2.77555756e-16	1.002214	1.000091	discard	1mode Ka=0.35	myagent	spectral	0	-1.504169
exp1004	2.35513869e-16	1.003257	1.000154	discard	1mode Ka=0.4	myagent	spectral	0	-1.484921
exp1005	3.14018492e-16	1.005811	1.000371	discard	1mode Ka=0.5	myagent	spectral	1	-1.439065
exp1006	0.00000000e+00	1.001489	1.000056	discard	Ka=0.31 1mode verify	myagent	spectral	0	-1.517772
exp1007	0.00000000e+00	1.001489	1.000056	discard	Ka=0.31 1mode verify	myagent	spectral	1	-1.517772
exp1008	0.00000000e+00	1.001489	1.000056	discard	Ka=0.31 1mode verify	myagent	spectral	0	-1.517772
exp1009	0.00000000e+00	1.001489	-1.000056	discard	Ka=0.31 1mode neg	myagent	spectral	0	-1.517772
exp1010	5.55111512e-17	1.001322	1.000049	discard	1mode Ka=0.300	myagent	spectral	0	-1.520921
exp1011	5.55111512e-17	1.001405	1.000053	discard	1mode Ka=0.305	myagent	spectral	0	-1.519359
exp1012	1.57009246e-16	1.001455	1.000055	discard	1mode Ka=0.308	myagent	spectral	0	-1.518410
exp1013	1.24126708e-16	1.001472	1.000055	discard	1mode Ka=0.309	myagent	spectral	1	-1.518091
exp1014	0.00000000e+00	1.001489	1.000056	discard	1mode Ka=0.310	myagent	spectral	0	-1.517772
exp1015	1.24126708e-16	1.001506	1.000057	discard	1mode Ka=0.311	myagent	spectral	0	-1.517451
exp1016	3.55444798e-16	1.001523	1.000058	discard	1mode Ka=0.312	myagent	spectral	0	-1.517130
exp1017	2.00148302e-16	1.001574	1.000060	discard	1mode Ka=0.315	myagent	spectral	0	-1.516159
exp1018	5.55111512e-17	1.001661	1.000064	discard	1mode Ka=0.320	myagent	spectral	0	-1.514522
exp1019	1.24126708e-16	0.998996	1.000000	discard	1mode Ka=0.0100	myagent	spectral	0	-1.567603
exp1020	1.24126708e-16	0.998997	1.000000	discard	1mode Ka=0.0200	myagent	spectral	0	-1.567446
exp1021	1.75541673e-16	0.999004	1.000000	discard	1mode Ka=0.0300	myagent	spectral	0	-1.567185
exp1022	2.00148302e-16	0.999017	1.000000	discard	1mode Ka=0.0400	myagent	spectral	1	-1.566819
exp1023	1.24126708e-16	0.999035	1.000000	discard	1mode Ka=0.0500	myagent	spectral	0	-1.566349
exp1024	1.75541673e-16	0.999059	1.000000	discard	1mode Ka=0.0600	myagent	spectral	0	-1.565775
exp1025	2.35513869e-16	0.999089	1.000000	discard	1mode Ka=0.0700	myagent	spectral	0	-1.565097
exp1026	1.57009246e-16	0.999124	1.000000	discard	1mode Ka=0.0800	myagent	spectral	1	-1.564314
exp1027	2.98936698e-16	0.999164	1.000000	discard	1mode Ka=0.0900	myagent	spectral	0	-1.563427
exp1028	3.72380123e-16	0.999210	1.000001	discard	1mode Ka=0.1000	myagent	spectral	0	-1.562436
exp1029	3.23682852e-16	0.999262	1.000001	discard	1mode Ka=0.1100	myagent	spectral	0	-1.561341
exp1030	3.72380123e-16	0.999319	1.000001	discard	1mode Ka=0.1200	myagent	spectral	1	-1.560142
exp1031	4.00296604e-16	0.999382	1.000002	discard	1mode Ka=0.1300	myagent	spectral	0	-1.558839
exp1032	7.85046229e-17	0.999450	1.000002	discard	1mode Ka=0.1400	myagent	spectral	0	-1.557433
exp1033	1.24126708e-16	0.999525	1.000003	discard	1mode Ka=0.1500	myagent	spectral	0	-1.555923
exp1034	2.00148302e-16	0.999604	1.000004	discard	1mode Ka=0.1600	myagent	spectral	1	-1.554309
exp1035	2.00148302e-16	0.999690	1.000005	discard	1mode Ka=0.1700	myagent	spectral	0	-1.552592
exp1036	2.77555756e-16	0.999781	1.000006	discard	1mode Ka=0.1800	myagent	spectral	0	-1.550771
exp1037	1.75541673e-16	0.999878	1.000008	discard	1mode Ka=0.1900	myagent	spectral	0	-1.548847
exp1038	7.85046229e-17	0.999980	1.000010	discard	1mode Ka=0.2000	myagent	spectral	1	-1.546820
exp1039	7.85046229e-17	1.000088	1.000012	discard	1mode Ka=0.2100	myagent	spectral	0	-1.544691
exp1040	1.66533454e-16	1.000202	1.000014	discard	1mode Ka=0.2200	myagent	spectral	0	-1.542458
exp1041	7.94798730e-16	1.000322	1.000017	discard	1mode Ka=0.2300	myagent	spectral	0	-1.540123
exp1042	4.74287484e-16	1.000447	1.000020	discard	1mode Ka=0.2400	myagent	spectral	1	-1.537686
exp1043	2.48253415e-16	1.000579	1.000024	discard	1mode Ka=0.2500	myagent	spectral	0	-1.535146
exp1044	2.77555756e-16	1.000716	1.000028	discard	1mode Ka=0.2600	myagent	spectral	0	-1.532505
exp1045	7.85046229e-17	1.000858	1.000032	discard	1mode Ka=0.2700	myagent	spectral	0	-1.529761
exp1046	7.85046229e-17	1.001007	1.000037	discard	1mode Ka=0.2800	myagent	spectral	1	-1.526916
exp1047	2.00148302e-16	1.001162	1.000043	discard	1mode Ka=0.2900	myagent	spectral	0	-1.523969
exp1048	5.55111512e-17	1.001322	1.000049	discard	1mode Ka=0.3000	myagent	spectral	0	-1.520921
exp1049	0.00000000e+00	1.001489	1.000056	discard	1mode Ka=0.3100	myagent	spectral	0	-1.517772
exp1050	5.55111512e-17	1.001661	1.000064	discard	1mode Ka=0.3200	myagent	spectral	1	-1.514522
exp1051	2.48253415e-16	1.001840	1.000072	discard	1mode Ka=0.3300	myagent	spectral	0	-1.511171
exp1052	2.48253415e-16	1.002024	1.000081	discard	1mode Ka=0.3400	myagent	spectral	0	-1.507721
exp1053	2.77555756e-16	1.002214	1.000091	discard	1mode Ka=0.3500	myagent	spectral	0	-1.504169
exp1054	1.75541673e-16	1.002411	1.000102	discard	1mode Ka=0.3600	myagent	spectral	1	-1.500519
exp1055	7.85046229e-17	1.002613	1.000113	discard	1mode Ka=0.3700	myagent	spectral	0	-1.496768
exp1056	2.77555756e-16	1.002822	1.000126	discard	1mode Ka=0.3800	myagent	spectral	0	-1.492918
exp1057	1.75541673e-16	1.003037	1.000140	discard	1mode Ka=0.3900	myagent	spectral	0	-1.488969
exp1058	2.35513869e-16	1.003257	1.000154	discard	1mode Ka=0.4000	myagent	spectral	1	-1.484921
exp1059	1.24126708e-16	1.003485	1.000170	discard	1mode Ka=0.4100	myagent	spectral	0	-1.480774
exp1060	1.24126708e-16	1.003718	1.000187	discard	1mode Ka=0.4200	myagent	spectral	0	-1.476529
exp1061	4.04127281e-16	1.003957	1.000205	discard	1mode Ka=0.4300	myagent	spectral	0	-1.472186
exp1062	2.00148302e-16	1.004203	1.000225	discard	1mode Ka=0.4400	myagent	spectral	0	-1.467746
exp1063	5.55111512e-17	1.004455	1.000245	discard	1mode Ka=0.4500	myagent	spectral	0	-1.463207
exp1064	1.24126708e-16	1.004714	1.000268	discard	1mode Ka=0.4600	myagent	spectral	0	-1.458572
exp1065	1.75541673e-16	1.004978	1.000291	discard	1mode Ka=0.4700	myagent	spectral	0	-1.453840
exp1066	6.98867537e-16	1.005249	1.000316	discard	1mode Ka=0.4800	myagent	spectral	0	-1.449011
exp1067	2.98936698e-16	1.005527	1.000343	discard	1mode Ka=0.4900	myagent	spectral	0	-1.444086
exp1068	3.14018492e-16	1.005811	1.000371	discard	1mode Ka=0.5000	myagent	spectral	0	-1.439065
exp1069	3.92523115e-17	1.006102	1.000401	discard	1mode Ka=0.5100	myagent	spectral	0	-1.433948
exp1070	5.55111512e-17	1.006398	1.000433	discard	1mode Ka=0.5200	myagent	spectral	0	-1.428736
exp1071	1.24126708e-16	1.006702	1.000466	discard	1mode Ka=0.5300	myagent	spectral	0	-1.423429
exp1072	1.24126708e-16	1.007012	1.000502	discard	1mode Ka=0.5400	myagent	spectral	0	-1.418028
exp1073	1.75541673e-16	1.007329	1.000539	discard	1mode Ka=0.5500	myagent	spectral	0	-1.412532
exp1074	2.74766180e-16	1.007652	1.000578	discard	1mode Ka=0.5600	myagent	spectral	1	-1.406942
exp1075	3.92523115e-17	1.007982	1.000619	discard	1mode Ka=0.5700	myagent	spectral	0	-1.401258
exp1076	1.17756934e-16	1.008318	1.000663	discard	1mode Ka=0.5800	myagent	spectral	0	-1.395482
exp1077	1.41526222e-16	1.008662	1.000708	discard	1mode Ka=0.5900	myagent	spectral	0	-1.389612
exp1078	7.85046229e-17	1.009012	1.000756	discard	1mode Ka=0.6000	myagent	spectral	1	-1.383649
exp1079	2.51337427e-16	1.009368	1.000806	discard	1mode Ka=0.6100	myagent	spectral	0	-1.377594
exp1080	4.77524979e-16	1.009732	1.000859	discard	1mode Ka=0.6200	myagent	spectral	0	-1.371448
exp1081	3.92523115e-17	1.010102	1.000914	discard	1mode Ka=0.6300	myagent	spectral	0	-1.365209
exp1082	5.55111512e-17	1.010479	1.000971	discard	1mode Ka=0.6400	myagent	spectral	0	-1.358880
exp1083	3.14018492e-16	1.010863	1.001031	discard	1mode Ka=0.6500	myagent	spectral	0	-1.352459
exp1084	1.57009246e-16	1.011254	1.001093	discard	1mode Ka=0.6600	myagent	spectral	0	-1.345948
exp1085	1.96261557e-16	1.011652	1.001158	discard	1mode Ka=0.6700	myagent	spectral	0	-1.339347
exp1086	3.42756075e-16	1.012057	1.001226	discard	1mode Ka=0.6800	myagent	spectral	0	-1.332656
exp1087	4.59855529e-16	1.012469	1.001297	discard	1mode Ka=0.6900	myagent	spectral	0	-1.325876
exp1088	1.75541673e-16	1.012888	1.001371	discard	1mode Ka=0.7000	myagent	spectral	0	-1.319007
exp1089	3.14631211e-16	1.013313	1.001447	discard	1mode Ka=0.7100	myagent	spectral	1	-1.312048
exp1090	1.75541673e-16	1.013746	1.001527	discard	1mode Ka=0.7200	myagent	spectral	0	-1.305002
exp1091	9.81307787e-17	1.014186	1.001610	discard	1mode Ka=0.7300	myagent	spectral	0	-1.297867
exp1092	3.16462252e-16	1.014633	1.001695	discard	1mode Ka=0.7400	myagent	spectral	0	-1.290645
exp1093	1.97240424e-16	1.015087	1.001784	discard	1mode Ka=0.7500	myagent	spectral	1	-1.283336
exp1094	3.14631211e-16	1.015548	1.001877	discard	1mode Ka=0.7600	myagent	spectral	0	-1.275939
exp1095	3.16462252e-16	1.016016	1.001972	discard	1mode Ka=0.7700	myagent	spectral	0	-1.268456
exp1096	5.90091632e-16	1.016491	1.002071	discard	1mode Ka=0.7800	myagent	spectral	0	-1.260887
exp1097	1.11022302e-16	1.016974	1.002174	discard	1mode Ka=0.7900	myagent	spectral	1	-1.253232
exp1098	3.55444798e-16	1.017463	1.002279	discard	1mode Ka=0.8000	myagent	spectral	0	-1.245492
exp1099	4.33555951e-16	1.017960	1.002389	discard	1mode Ka=0.8100	myagent	spectral	0	-1.237666
exp1100	3.14018492e-16	1.018464	1.002502	discard	1mode Ka=0.8200	myagent	spectral	0	-1.229755
exp1101	5.16283550e-16	1.018976	1.002619	discard	1mode Ka=0.8300	myagent	spectral	1	-1.221761
exp1102	2.00148302e-16	1.019494	1.002739	discard	1mode Ka=0.8400	myagent	spectral	0	-1.213682
exp1103	5.55111512e-17	1.020020	1.002864	discard	1mode Ka=0.8500	myagent	spectral	0	-1.205519
exp1104	2.35513869e-16	1.020553	1.002992	discard	1mode Ka=0.8600	myagent	spectral	0	-1.197273
exp1105	2.85761141e-16	1.021093	1.003124	discard	1mode Ka=0.8700	myagent	spectral	1	-1.188944
exp1106	4.77524979e-16	1.021641	1.003260	discard	1mode Ka=0.8800	myagent	spectral	0	-1.180532
exp1107	1.57009246e-16	1.022195	1.003400	discard	1mode Ka=0.8900	myagent	spectral	0	-1.172038
exp1108	3.94480848e-16	1.022757	1.003544	discard	1mode Ka=0.9000	myagent	spectral	0	-1.163462
exp1109	1.11022302e-16	1.023327	1.003692	discard	1mode Ka=0.9100	myagent	spectral	1	-1.154804
exp1110	1.57009246e-16	1.023903	1.003845	discard	1mode Ka=0.9200	myagent	spectral	0	-1.146064
exp1111	4.33555951e-16	1.024487	1.004002	discard	1mode Ka=0.9300	myagent	spectral	0	-1.137244
exp1112	2.74766180e-16	1.025079	1.004163	discard	1mode Ka=0.9400	myagent	spectral	0	-1.128343
exp1113	1.61841426e-16	1.025677	1.004328	discard	1mode Ka=0.9500	myagent	spectral	1	-1.119362
exp1114	2.38762489e-16	1.026283	1.004498	discard	1mode Ka=0.9600	myagent	spectral	0	-1.110300
exp1115	4.77524979e-16	1.026896	1.004672	discard	1mode Ka=0.9700	myagent	spectral	0	-1.101159
exp1116	5.11787527e-16	1.027516	1.004851	discard	1mode Ka=0.9800	myagent	spectral	0	-1.091938
exp1117	2.74766180e-16	1.028144	1.005034	discard	1mode Ka=0.9900	myagent	spectral	1	-1.082639
exp1118	2.00148302e-16	1.001162	1.000043	discard	1mode Ka=0.2900	myagent	spectral	0	-1.523969
exp1119	2.35513869e-16	1.001178	1.000044	discard	1mode Ka=0.2910	myagent	spectral	0	-1.523669
exp1120	2.28878340e-16	1.001193	1.000044	discard	1mode Ka=0.2920	myagent	spectral	0	-1.523367
exp1121	2.48253415e-16	1.001209	1.000045	discard	1mode Ka=0.2930	myagent	spectral	1	-1.523065
exp1122	1.11022302e-16	1.001225	1.000046	discard	1mode Ka=0.2940	myagent	spectral	0	-1.522762
exp1123	1.11022302e-16	1.001241	1.000046	discard	1mode Ka=0.2950	myagent	spectral	0	-1.522458
exp1124	2.35513869e-16	1.001257	1.000047	discard	1mode Ka=0.2960	myagent	spectral	0	-1.522152
exp1125	2.98936698e-16	1.001274	1.000047	discard	1mode Ka=0.2970	myagent	spectral	1	-1.521846
exp1126	5.55111512e-17	1.001290	1.000048	discard	1mode Ka=0.2980	myagent	spectral	0	-1.521539
exp1127	2.48253415e-16	1.001306	1.000049	discard	1mode Ka=0.2990	myagent	spectral	0	-1.521230
exp1128	5.55111512e-17	1.001322	1.000049	discard	1mode Ka=0.3000	myagent	spectral	0	-1.520921
exp1129	7.85046229e-17	1.001339	1.000050	discard	1mode Ka=0.3010	myagent	spectral	1	-1.520611
exp1130	3.14018492e-16	1.001355	1.000051	discard	1mode Ka=0.3020	myagent	spectral	0	-1.520299
exp1131	1.24126708e-16	1.001372	1.000051	discard	1mode Ka=0.3030	myagent	spectral	0	-1.519987
exp1132	5.55111512e-17	1.001388	1.000052	discard	1mode Ka=0.3040	myagent	spectral	0	-1.519673
exp1133	5.55111512e-17	1.001405	1.000053	discard	1mode Ka=0.3050	myagent	spectral	1	-1.519359
exp1134	1.24126708e-16	1.001422	1.000053	discard	1mode Ka=0.3060	myagent	spectral	0	-1.519044
exp1135	1.75541673e-16	1.001438	1.000054	discard	1mode Ka=0.3070	myagent	spectral	0	-1.518727
exp1136	1.57009246e-16	1.001455	1.000055	discard	1mode Ka=0.3080	myagent	spectral	0	-1.518410
exp1137	1.24126708e-16	1.001472	1.000055	discard	1mode Ka=0.3090	myagent	spectral	1	-1.518091
