exp_id	residual	solution_norm	solution_mean	status	description	agent	design	elapsed_s	solution_energy
exp1138	0.00000000e+00	1.001489	1.000056	discard	1mode Ka=0.3100	myagent	spectral	0	-1.517772
exp1139	1.24126708e-16	1.001506	1.000057	discard	1mode Ka=0.3110	myagent	spectral	0	-1.517451
exp1140	3.55444798e-16	1.001523	1.000058	discard	1mode Ka=0.3120	myagent	spectral	0	-1.517130
exp1141	3.14018492e-16	1.001540	1.000058	discard	1mode Ka=0.3130	myagent	spectral	1	-1.516807
exp1142	1.75541673e-16	1.001557	1.000059	discard	1mode Ka=0.3140	myagent	spectral	0	-1.516484
exp1143	2.00148302e-16	1.001574	1.000060	discard	1mode Ka=0.3150	myagent	spectral	0	-1.516159
exp1144	1.11022302e-16	1.001592	1.000061	discard	1mode Ka=0.3160	myagent	spectral	0	-1.515834
exp1145	2.00148302e-16	1.001609	1.000061	discard	1mode Ka=0.3170	myagent	spectral	1	-1.515507
exp1146	1.57009246e-16	1.001626	1.000062	discard	1mode Ka=0.3180	myagent	spectral	0	-1.515180
exp1147	2.28878340e-16	1.001644	1.000063	discard	1mode Ka=0.3190	myagent	spectral	0	-1.514851
exp1148	5.55111512e-17	1.001661	1.000064	discard	1mode Ka=0.3200	myagent	spectral	0	-1.514522
exp1149	0.00000000e+00	1.001489	1.000056	discard	Ka=0.31 1modes	myagent	spectral	0	-1.517772
exp1150	5.82205866e-16	1.001461	1.000028	discard	Ka=0.31 2modes	myagent	spectral	0	-1.517772
exp1151	2.30572529e-16	1.001459	1.000021	discard	Ka=0.31 3modes	myagent	spectral	1	-1.517684
exp1152	6.12826516e-16	1.001459	1.000021	discard	Ka=0.31 4modes	myagent	spectral	0	-1.517684
exp1153	1.62367586e-14	1.001459	1.000021	discard	Ka=0.31 8modes	myagent	spectral	0	-1.517684
exp1154	1.65011100e-14	1.001459	1.000021	discard	Ka=0.31 16modes	myagent	spectral	0	-1.517684
exp1155	crash	0	0	crash	Ka=0.31 32modes	myagent	spectral	1	0
exp1156	0.00000000e+00	1.139035	1.140175	discard	1 mode K_frequency=2 exact	manual	spectral	0	-1.426566
exp1157	2.00148302e-16	1.001480	1.000056	discard	1mode Ka=0.30950	myagent	spectral	1	-1.517932
exp1158	2.28878340e-16	1.001482	1.000056	discard	1mode Ka=0.30960	myagent	spectral	0	-1.517900
exp1159	1.24126708e-16	1.001484	1.000056	discard	1mode Ka=0.30970	myagent	spectral	0	-1.517868
exp1160	7.85046229e-17	1.001485	1.000056	discard	1mode Ka=0.30980	myagent	spectral	0	-1.517836
exp1161	5.55111512e-17	1.001487	1.000056	discard	1mode Ka=0.30990	myagent	spectral	1	-1.517804
exp1162	0.00000000e+00	1.001489	1.000056	discard	1mode Ka=0.31000	myagent	spectral	0	-1.517772
exp1163	7.85046229e-17	1.001491	1.000056	discard	1mode Ka=0.31010	myagent	spectral	0	-1.517740
exp1164	2.22044605e-16	1.001492	1.000056	discard	1mode Ka=0.31020	myagent	spectral	0	-1.517708
exp1165	2.22044605e-16	1.001494	1.000056	discard	1mode Ka=0.31030	myagent	spectral	1	-1.517676
exp1166	1.11022302e-16	1.001496	1.000056	discard	1mode Ka=0.31040	myagent	spectral	0	-1.517644
exp1167	7.85046229e-17	1.001497	1.000057	discard	1mode Ka=0.31050	myagent	spectral	0	-1.517612
exp1168	5.55111512e-17	1.001499	1.000057	discard	1mode Ka=0.31060	myagent	spectral	0	-1.517580
exp1169	0.00000000e+00	1.139035	-1.140175	discard	1 mode K_frequency=2 neg branch exact	manual	spectral	1	-1.426566
exp1170	5.55111512e-17	1.001487	1.000056	discard	1mode Ka=0.309900	myagent	spectral	0	-1.517804
exp1171	7.85046229e-17	1.001487	1.000056	discard	1mode Ka=0.309910	myagent	spectral	0	-1.517801
exp1172	7.85046229e-17	1.001487	1.000056	discard	1mode Ka=0.309920	myagent	spectral	1	-1.517797
exp1173	3.14018492e-16	1.001488	1.000056	discard	1mode Ka=0.309930	myagent	spectral	0	-1.517794
exp1174	1.75541673e-16	1.001488	1.000056	discard	1mode Ka=0.309940	myagent	spectral	0	-1.517791
exp1175	2.77555756e-16	1.001488	1.000056	discard	1mode Ka=0.309950	myagent	spectral	0	-1.517788
exp1176	1.24126708e-16	1.001488	1.000056	discard	1mode Ka=0.309960	myagent	spectral	1	-1.517785
exp1177	2.00148302e-16	1.001488	1.000056	discard	1mode Ka=0.309970	myagent	spectral	0	-1.517781
exp1178	1.75541673e-16	1.001488	1.000056	discard	1mode Ka=0.309980	myagent	spectral	0	-1.517778
exp1179	2.98936698e-16	1.001489	1.000056	discard	1mode Ka=0.309990	myagent	spectral	0	-1.517775
exp1180	0.00000000e+00	1.001489	1.000056	discard	1mode Ka=0.310000	myagent	spectral	1	-1.517772
exp1181	1.24126708e-16	1.001489	1.000056	discard	1mode Ka=0.310010	myagent	spectral	0	-1.517769
exp1182	7.85046229e-17	1.001489	1.000056	discard	1mode Ka=0.310020	myagent	spectral	0	-1.517765
exp1183	2.00148302e-16	1.001489	1.000056	discard	1mode Ka=0.310030	myagent	spectral	0	-1.517762
exp1184	0.00000000e+00	1.001489	1.000056	discard	1mode Ka=0.310040	myagent	spectral	1	-1.517759
exp1185	7.85046229e-17	1.001490	1.000056	discard	1mode Ka=0.310050	myagent	spectral	0	-1.517756
exp1186	1.75541673e-16	1.001490	1.000056	discard	1mode Ka=0.310060	myagent	spectral	0	-1.517753
exp1187	7.85046229e-17	1.001490	1.000056	discard	1mode Ka=0.310070	myagent	spectral	0	-1.517749
exp1188	5.55111512e-17	1.001490	1.000056	discard	1mode Ka=0.310080	myagent	spectral	1	-1.517746
exp1189	5.55111512e-17	1.001490	1.000056	discard	1mode Ka=0.310090	myagent	spectral	0	-1.517743
exp1190	7.85046229e-17	1.001491	1.000056	discard	1mode Ka=0.310100	myagent	spectral	0	-1.517740
exp1191	3.47161953e-20	0.000000	-0.000000	discard	Ka=0.31004 offset=0.0	myagent	spectral	0	-0.000000
exp1192	0.00000000e+00	1.001489	1.000056	discard	Ka=0.31004 offset=1.0	myagent	spectral	0	-1.517759
exp1193	0.00000000e+00	1.001489	-1.000056	discard	Ka=0.31004 offset=-1.0	myagent	spectral	1	-1.517759
exp1194	0.00000000e+00	0.000000	0.000000	discard	trivial Ka=0.31	myagent	spectral	1	0.000000
exp1195	2.00234886e-15	1.000987	1.000014	discard	4modes Ka=0.2800	myagent	spectral	1	-1.526857
exp1196	6.05237041e-16	1.001017	1.000015	discard	4modes Ka=0.2820	myagent	spectral	0	-1.526274
exp1197	2.76434595e-15	1.001047	1.000015	discard	4modes Ka=0.2840	myagent	spectral	0	-1.525687
exp1198	1.41120794e-15	1.001077	1.000015	discard	4modes Ka=0.2860	myagent	spectral	0	-1.525096
exp1199	1.36810636e-15	1.001108	1.000016	discard	4modes Ka=0.2880	myagent	spectral	1	-1.524501
exp1200	1.16940436e-15	1.001139	1.000016	discard	4modes Ka=0.2900	myagent	spectral	0	-1.523902
exp1201	1.51528667e-15	1.001170	1.000017	discard	4modes Ka=0.2920	myagent	spectral	0	-1.523298
exp1202	1.39597715e-15	1.001201	1.000017	discard	4modes Ka=0.2940	myagent	spectral	0	-1.522691
exp1203	2.07912235e-15	1.001232	1.000018	discard	4modes Ka=0.2960	myagent	spectral	0	-1.522079
exp1204	1.69516482e-15	1.001264	1.000018	discard	4modes Ka=0.2980	myagent	spectral	0	-1.521464
exp1205	1.86448479e-16	1.001296	1.000019	discard	4modes Ka=0.3000	myagent	spectral	0	-1.520844
exp1206	4.31998393e-16	1.001328	1.000019	discard	4modes Ka=0.3020	myagent	spectral	1	-1.520220
exp1207	1.07836752e-15	1.001360	1.000020	discard	4modes Ka=0.3040	myagent	spectral	0	-1.519592
exp1208	3.12815619e-15	1.001393	1.000020	discard	4modes Ka=0.3060	myagent	spectral	0	-1.518960
exp1209	1.75464857e-15	1.001426	1.000021	discard	4modes Ka=0.3080	myagent	spectral	0	-1.518324
exp1210	5.60463356e-16	1.001459	1.000021	discard	4modes Ka=0.3100	myagent	spectral	0	-1.517684
exp1211	1.17887703e-15	1.001492	1.000022	discard	4modes Ka=0.3120	myagent	spectral	0	-1.517040
exp1212	1.30055679e-15	1.001525	1.000022	discard	4modes Ka=0.3140	myagent	spectral	0	-1.516392
exp1213	2.86007032e-15	1.001559	1.000023	discard	4modes Ka=0.3160	myagent	spectral	1	-1.515739
exp1214	1.01852941e-15	1.001593	1.000023	discard	4modes Ka=0.3180	myagent	spectral	0	-1.515083
exp1215	1.08090952e-15	1.001627	1.000024	discard	4modes Ka=0.3200	myagent	spectral	0	-1.514422
exp1216	2.24890825e-15	1.001661	1.000025	discard	4modes Ka=0.3220	myagent	spectral	0	-1.513758
exp1217	1.43800938e-15	1.001696	1.000025	discard	4modes Ka=0.3240	myagent	spectral	1	-1.513089
exp1218	8.15135468e-16	1.001731	1.000026	discard	4modes Ka=0.3260	myagent	spectral	0	-1.512417
exp1219	1.78743537e-15	1.001766	1.000026	discard	4modes Ka=0.3280	myagent	spectral	0	-1.511740
exp1220	0.00000000e+00	1.139035	1.140175	discard	K_freq=0 4modes pos	myagent	spectral	0	-1.426566
exp1221	0.00000000e+00	1.139035	-1.140175	discard	K_freq=0 4modes neg	myagent	spectral	0	-1.426566
exp1222	0.00000000e+00	0.998999	1.000000	discard	sine 1mode offset=1.0	myagent	spectral	0	-1.567655
exp1223	0.00000000e+00	0.998999	-1.000000	discard	sine 1mode offset=-1.0	myagent	spectral	0	-1.567655
exp1224	5.20532678e-16	1.001296	1.000019	discard	3modes n_mode=2 amp=0.001	myagent	spectral	0	-1.520844
exp1225	4.51446023e-16	1.001296	1.000019	discard	3modes n_mode=2 amp=0.005	myagent	spectral	0	-1.520844
exp1226	3.47499363e-16	1.001296	1.000019	discard	3modes n_mode=2 amp=0.01	myagent	spectral	1	-1.520844
exp1227	2.12761318e-16	1.001296	1.000019	discard	3modes n_mode=2 amp=0.02	myagent	spectral	0	-1.520844
exp1228	4.37471443e-16	1.001296	1.000019	discard	3modes n_mode=2 amp=0.05	myagent	spectral	0	-1.520844
exp1229	5.20532678e-16	1.001296	1.000019	discard	3modes n_mode=0 amp=0.0	myagent	spectral	0	-1.520844
exp1230	4.22769823e-16	1.001296	1.000019	discard	3modes n_mode=0 amp=0.05	myagent	spectral	1	-1.520844
exp1231	5.20532678e-16	1.001296	1.000019	discard	3modes n_mode=0 amp=0.10	myagent	spectral	0	-1.520844
exp1232	4.37471443e-16	1.001296	1.000019	discard	3modes n_mode=0 amp=0.15	myagent	spectral	0	-1.520844
exp1233	2.12761318e-16	1.001296	1.000019	discard	3modes amp=0.010	myagent	spectral	0	-1.520844
exp1234	2.12761318e-16	1.001296	1.000019	discard	3modes amp=0.015	myagent	spectral	1	-1.520844
exp1235	4.37471443e-16	1.001296	1.000019	discard	3modes amp=0.020	myagent	spectral	0	-1.520844
exp1236	4.37471443e-16	1.001296	1.000019	discard	3modes amp=0.025	myagent	spectral	0	-1.520844
exp1237	2.12761318e-16	1.001296	1.000019	discard	3modes amp=0.030	myagent	spectral	1	-1.520844
exp1238	5.20532678e-16	1.001296	1.000019	discard	3modes amp=0.035	myagent	spectral	0	-1.520844
exp1239	4.37471443e-16	1.001296	1.000019	discard	3modes amp=0.040	myagent	spectral	0	-1.520844
exp1240	4.22769823e-16	1.001296	1.000019	discard	3modes amp=0.045	myagent	spectral	0	-1.520844
exp1241	1.84479774e-16	1.001296	1.000019	discard	3modes amp=0.050	myagent	spectral	1	-1.520844
exp1242	5.20532678e-16	1.001296	1.000019	discard	3modes amp=0.055	myagent	spectral	0	-1.520844
exp1243	4.37471443e-16	1.001296	1.000019	discard	3modes amp=0.060	myagent	spectral	0	-1.520844
exp1244	4.09286918e-16	1.001296	1.000019	discard	3modes amp=0.065	myagent	spectral	1	-1.520844
exp1245	5.20532678e-16	1.001296	1.000019	discard	3modes amp=0.070	myagent	spectral	0	-1.520844
exp1246	4.37471443e-16	1.001296	1.000019	discard	3modes amp=0.075	myagent	spectral	0	-1.520844
exp1247	4.45865556e-16	1.001296	1.000019	discard	3modes amp=0.080	myagent	spectral	0	-1.520844
exp1248	5.20532678e-16	1.001296	1.000019	discard	3modes amp=0.085	myagent	spectral	0	-1.520844
exp1249	2.79471795e-16	1.001296	1.000019	discard	3modes amp=0.090	myagent	spectral	0	-1.520844
exp1250	4.56009058e-16	1.001296	1.000019	discard	3modes amp=0.095	myagent	spectral	0	-1.520844
exp1251	4.37471443e-16	1.001296	1.000019	discard	3modes amp=0.100	myagent	spectral	1	-1.520844
exp1252	4.37471443e-16	1.001296	1.000019	discard	3modes amp=0.105	myagent	spectral	0	-1.520844
exp1253	4.45532468e-16	1.001296	1.000019	discard	3modes amp=0.110	myagent	spectral	0	-1.520844
exp1254	6.12197654e-16	1.001296	1.000019	discard	3modes amp=0.115	myagent	spectral	1	-1.520844
exp1255	2.22892279e-16	1.001296	1.000019	discard	3modes amp=0.120	myagent	spectral	0	-1.520844
exp1256	6.22234776e-16	1.001296	1.000019	discard	3modes amp=0.125	myagent	spectral	0	-1.520844
exp1257	2.12761318e-16	1.001296	1.000019	discard	3modes amp=0.130	myagent	spectral	0	-1.520844
exp1258	4.37471443e-16	1.001296	1.000019	discard	3modes amp=0.135	myagent	spectral	1	-1.520844
exp1259	4.37471443e-16	1.001296	1.000019	discard	3modes amp=0.140	myagent	spectral	0	-1.520844
exp1260	3.02870333e-16	1.001296	1.000019	discard	3modes amp=0.145	myagent	spectral	0	-1.520844
exp1261	5.20532678e-16	1.001296	1.000019	discard	3modes amp=0.150	myagent	spectral	1	-1.520844
exp1262	3.02870333e-16	1.001296	1.000019	discard	3modes amp=0.155	myagent	spectral	0	-1.520844
exp1263	4.37471443e-16	1.001296	1.000019	discard	3modes amp=0.160	myagent	spectral	0	-1.520844
exp1264	2.12761318e-16	1.001296	1.000019	discard	3modes amp=0.165	myagent	spectral	1	-1.520844
exp1265	1.84479774e-16	1.001296	1.000019	discard	3modes amp=0.170	myagent	spectral	0	-1.520844
exp1266	1.84479774e-16	1.001296	1.000019	discard	3modes amp=0.175	myagent	spectral	0	-1.520844
exp1267	2.12761318e-16	1.001296	1.000019	discard	3modes amp=0.180	myagent	spectral	0	-1.520844
exp1268	3.02870333e-16	1.001296	1.000019	discard	3modes amp=0.185	myagent	spectral	1	-1.520844
exp1269	5.59904676e-16	1.001296	1.000019	discard	3modes amp=0.190	myagent	spectral	0	-1.520844
exp1270	3.47499363e-16	1.001296	1.000019	discard	3modes amp=0.195	myagent	spectral	0	-1.520844
exp1271	4.22769823e-16	1.001296	1.000019	discard	3modes amp=0.200	myagent	spectral	1	-1.520844
exp1272	4.37471443e-16	1.001296	1.000019	discard	3modes amp=0.205	myagent	spectral	0	-1.520844
exp1273	2.12761318e-16	1.001296	1.000019	discard	3modes amp=0.210	myagent	spectral	0	-1.520844
exp1274	6.22234776e-16	1.001296	1.000019	discard	3modes amp=0.215	myagent	spectral	1	-1.520844
exp1275	4.22769823e-16	1.001296	1.000019	discard	3modes amp=0.220	myagent	spectral	0	-1.520844
exp1276	4.37471443e-16	1.001296	1.000019	discard	3modes amp=0.225	myagent	spectral	0	-1.520844
exp1277	5.20532678e-16	1.001296	1.000019	discard	3modes amp=0.230	myagent	spectral	0	-1.520844
exp1278	5.20532678e-16	1.001296	1.000019	discard	3modes amp=0.235	myagent	spectral	1	-1.520844
exp1279	4.37471443e-16	1.001296	1.000019	discard	3modes amp=0.240	myagent	spectral	0	-1.520844
exp1280	3.02870333e-16	1.001296	1.000019	discard	3modes amp=0.245	myagent	spectral	0	-1.520844
exp1281	2.12761318e-16	1.001296	1.000019	discard	3modes amp=0.250	myagent	spectral	1	-1.520844
exp1282	4.86382971e-16	1.001296	1.000019	discard	3modes amp=0.255	myagent	spectral	0	-1.520844
exp1283	5.20532678e-16	1.001296	1.000019	discard	3modes amp=0.260	myagent	spectral	0	-1.520844
exp1284	4.37471443e-16	1.001296	1.000019	discard	3modes amp=0.265	myagent	spectral	0	-1.520844
exp1285	5.20532678e-16	1.001296	1.000019	discard	3modes amp=0.270	myagent	spectral	0	-1.520844
exp1286	1.84479774e-16	1.001296	1.000019	discard	3modes amp=0.275	myagent	spectral	0	-1.520844
exp1287	3.02870333e-16	1.001296	1.000019	discard	3modes amp=0.280	myagent	spectral	0	-1.520844
exp1288	4.37471443e-16	1.001296	1.000019	discard	3modes amp=0.285	myagent	spectral	1	-1.520844
exp1289	4.56009058e-16	1.001296	1.000019	discard	3modes amp=0.290	myagent	spectral	0	-1.520844
exp1290	2.12761318e-16	1.001296	1.000019	discard	3modes amp=0.295	myagent	spectral	0	-1.520844
exp1291	2.12761318e-16	1.001296	1.000019	discard	3modes amp=0.300	myagent	spectral	1	-1.520844
exp1292	4.22769823e-16	1.001296	1.000019	discard	3modes amp=0.305	myagent	spectral	0	-1.520844
exp1293	4.46108463e-16	1.001296	1.000019	discard	3modes amp=0.310	myagent	spectral	0	-1.520844
exp1294	4.37471443e-16	1.001296	1.000019	discard	3modes amp=0.315	myagent	spectral	0	-1.520844
exp1295	4.22769823e-16	1.001296	1.000019	discard	3modes amp=0.320	myagent	spectral	0	-1.520844
exp1296	5.20532678e-16	1.001296	1.000019	discard	3modes amp=0.325	myagent	spectral	0	-1.520844
exp1297	4.22769823e-16	1.001296	1.000019	discard	3modes amp=0.330	myagent	spectral	0	-1.520844
exp1298	4.37471443e-16	1.001296	1.000019	discard	3modes amp=0.335	myagent	spectral	1	-1.520844
exp1299	2.12761318e-16	1.001296	1.000019	discard	3modes amp=0.340	myagent	spectral	0	-1.520844
exp1300	2.12761318e-16	1.001296	1.000019	discard	3modes amp=0.345	myagent	spectral	0	-1.520844
exp1301	4.37471443e-16	1.001296	1.000019	discard	3modes amp=0.350	myagent	spectral	1	-1.520844
exp1302	3.02870333e-16	1.001296	1.000019	discard	3modes amp=0.355	myagent	spectral	0	-1.520844
exp1303	4.37471443e-16	1.001296	1.000019	discard	3modes amp=0.360	myagent	spectral	0	-1.520844
exp1304	2.12761318e-16	1.001296	1.000019	discard	3modes amp=0.365	myagent	spectral	0	-1.520844
exp1305	2.69398330e-16	1.001296	1.000019	discard	3modes amp=0.370	myagent	spectral	0	-1.520844
exp1306	4.45424385e-16	1.001296	1.000019	discard	3modes amp=0.375	myagent	spectral	0	-1.520844
exp1307	4.92881313e-16	1.001296	1.000019	discard	3modes amp=0.380	myagent	spectral	0	-1.520844
exp1308	3.02870333e-16	1.001296	1.000019	discard	3modes amp=0.385	myagent	spectral	1	-1.520844
exp1309	4.56009058e-16	1.001296	1.000019	discard	3modes amp=0.390	myagent	spectral	0	-1.520844
exp1310	1.84479774e-16	1.001296	1.000019	discard	3modes amp=0.395	myagent	spectral	0	-1.520844
exp1311	2.00328643e-16	1.000987	1.000014	discard	3modes Ka=0.2800	myagent	spectral	0	-1.526857
exp1312	1.36709711e-16	1.001062	1.000015	discard	3modes Ka=0.2850	myagent	spectral	1	-1.525392
exp1313	5.32089961e-16	1.001139	1.000016	discard	3modes Ka=0.2900	myagent	spectral	0	-1.523902
exp1314	4.06641286e-16	1.001216	1.000017	discard	3modes Ka=0.2950	myagent	spectral	0	-1.522385
exp1315	1.84479774e-16	1.001296	1.000019	discard	3modes Ka=0.3000	myagent	spectral	0	-1.520844
exp1316	4.75445057e-16	1.001376	1.000020	discard	3modes Ka=0.3050	myagent	spectral	1	-1.519277
exp1317	1.10805250e-16	1.001459	1.000021	discard	3modes Ka=0.3100	myagent	spectral	0	-1.517684
exp1318	2.57145085e-16	1.001542	1.000023	discard	3modes Ka=0.3150	myagent	spectral	0	-1.516066
exp1319	5.41441258e-16	1.001627	1.000024	discard	3modes Ka=0.3200	myagent	spectral	1	-1.514422
exp1320	4.34175561e-16	1.001713	1.000026	discard	3modes Ka=0.3250	myagent	spectral	0	-1.512753
exp1321	4.32796415e-16	1.001426	1.000021	discard	3modes Ka=0.3080	myagent	spectral	0	-1.518324
exp1322	2.45980282e-16	1.001442	1.000021	discard	3modes Ka=0.3090	myagent	spectral	0	-1.518005
exp1323	1.10805250e-16	1.001459	1.000021	discard	3modes Ka=0.3100	myagent	spectral	1	-1.517684
exp1324	2.53039811e-16	1.001475	1.000021	discard	3modes Ka=0.3110	myagent	spectral	0	-1.517362
exp1325	5.49218311e-16	1.001492	1.000022	discard	3modes Ka=0.3120	myagent	spectral	0	-1.517040
exp1326	4.64810947e-16	1.001508	1.000022	discard	3modes Ka=0.3130	myagent	spectral	0	-1.516716
exp1327	5.80763727e-16	1.001525	1.000022	discard	3modes Ka=0.3140	myagent	spectral	1	-1.516392
exp1328	2.57145085e-16	1.001542	1.000023	discard	3modes Ka=0.3150	myagent	spectral	0	-1.516066
exp1329	1.46896018e-16	1.001559	1.000023	discard	3modes Ka=0.3160	myagent	spectral	0	-1.515739
exp1330	5.74051076e-16	1.001450	1.000021	discard	3modes Ka=0.30950	myagent	spectral	0	-1.517844
exp1331	1.10805250e-16	1.001459	1.000021	discard	3modes Ka=0.31000	myagent	spectral	0	-1.517684
exp1332	6.07764193e-16	1.001467	1.000021	discard	3modes Ka=0.31050	myagent	spectral	0	-1.517523
exp1333	3.81870391e-16	1.001459	1.000021	discard	Ka=0.31 3modes amp=0.01	myagent	spectral	1	-1.517684
exp1334	2.30572529e-16	1.001459	1.000021	discard	Ka=0.31 3modes amp=0.03	myagent	spectral	0	-1.517684
exp1335	1.10805250e-16	1.001459	1.000021	discard	Ka=0.31 3modes amp=0.05	myagent	spectral	0	-1.517684
exp1336	2.74590891e-16	1.001459	1.000021	discard	Ka=0.31 3modes amp=0.07	myagent	spectral	0	-1.517684
exp1337	2.30572529e-16	1.001459	1.000021	discard	Ka=0.31 3modes amp=0.10	myagent	spectral	1	-1.517684
exp1338	2.30572529e-16	1.001459	1.000021	discard	Ka=0.31 3modes amp=0.12	myagent	spectral	0	-1.517684
exp1339	2.30572529e-16	1.001459	1.000021	discard	Ka=0.31 3modes amp=0.14	myagent	spectral	0	-1.517684
exp1340	2.30572529e-16	1.001459	1.000021	discard	Ka=0.31 3modes amp=0.15	myagent	spectral	0	-1.517684
exp1341	1.10805250e-16	1.001459	1.000021	discard	Ka=0.31 3modes amp=0.16	myagent	spectral	0	-1.517684
exp1342	3.62054701e-16	1.001459	1.000021	discard	Ka=0.31 3modes amp=0.17	myagent	spectral	0	-1.517684
exp1343	2.30572529e-16	1.001459	1.000021	discard	Ka=0.31 3modes amp=0.18	myagent	spectral	0	-1.517684
exp1344	5.26777378e-16	1.001459	1.000021	discard	Ka=0.31 3modes amp=0.20	myagent	spectral	1	-1.517684
exp1345	2.74590891e-16	1.001459	1.000021	discard	Ka=0.31 3modes amp=0.25	myagent	spectral	0	-1.517684
exp1346	2.30572529e-16	1.001459	-1.000021	discard	Ka=0.31 3modes neg amp=0.05	myagent	spectral	1	-1.517684
exp1347	2.90606311e-16	1.001459	-1.000021	discard	Ka=0.31 3modes neg amp=0.12	myagent	spectral	0	-1.517684
exp1348	2.30572529e-16	1.001459	-1.000021	discard	Ka=0.31 3modes neg amp=0.16	myagent	spectral	0	-1.517684
exp1349	1.10805250e-16	1.001459	-1.000021	discard	Ka=0.31 3m neg 0.010	myagent	spectral	0	-1.517684
exp1350	1.10805250e-16	1.001459	-1.000021	discard	Ka=0.31 3m neg 0.020	myagent	spectral	0	-1.517684
exp1351	1.10805250e-16	1.001459	-1.000021	discard	Ka=0.31 3m neg 0.030	myagent	spectral	0	-1.517684
exp1352	1.94928174e-16	1.001459	-1.000021	discard	Ka=0.31 3m neg 0.040	myagent	spectral	1	-1.517684
exp1353	2.30572529e-16	1.001459	-1.000021	discard	Ka=0.31 3m neg 0.050	myagent	spectral	0	-1.517684
exp1354	1.10805250e-16	1.001459	-1.000021	discard	Ka=0.31 3m neg 0.060	myagent	spectral	0	-1.517684
exp1355	1.10805250e-16	1.001459	-1.000021	discard	Ka=0.31 3m neg 0.070	myagent	spectral	1	-1.517684
exp1356	1.10805250e-16	1.001459	-1.000021	discard	Ka=0.31 3m neg 0.080	myagent	spectral	0	-1.517684
exp1357	2.30572529e-16	1.001459	-1.000021	discard	Ka=0.31 3m neg 0.090	myagent	spectral	0	-1.517684
exp1358	1.10805250e-16	1.001459	-1.000021	discard	Ka=0.31 3m neg 0.100	myagent	spectral	1	-1.517684
exp1359	1.10805250e-16	1.001459	-1.000021	discard	Ka=0.31 3m neg 0.110	myagent	spectral	0	-1.517684
exp1360	2.90606311e-16	1.001459	-1.000021	discard	Ka=0.31 3m neg 0.120	myagent	spectral	0	-1.517684
exp1361	1.10805250e-16	1.001459	-1.000021	discard	Ka=0.31 3m neg 0.130	myagent	spectral	0	-1.517684
exp1362	2.30572529e-16	1.001459	-1.000021	discard	Ka=0.31 3m neg 0.140	myagent	spectral	0	-1.517684
exp1363	6.20762823e-16	1.001459	-1.000021	discard	Ka=0.31 3m neg 0.150	myagent	spectral	0	-1.517684
exp1364	2.30572529e-16	1.001459	-1.000021	discard	Ka=0.31 3m neg 0.160	myagent	spectral	0	-1.517684
