exp_id	residual	solution_norm	solution_mean	status	description	agent	design	elapsed_s	solution_energy
exp1365	3.62054701e-16	1.001459	-1.000021	discard	Ka=0.31 3m neg 0.170	myagent	spectral	1	-1.517684
exp1366	1.10805250e-16	1.001459	-1.000021	discard	Ka=0.31 3m neg 0.180	myagent	spectral	0	-1.517684
exp1367	1.10805250e-16	1.001459	-1.000021	discard	Ka=0.31 3m neg 0.190	myagent	spectral	0	-1.517684
exp1368	1.10805250e-16	1.001459	-1.000021	discard	Ka=0.31 3m neg 0.200	myagent	spectral	1	-1.517684
exp1369	1.10805250e-16	1.001459	-1.000021	discard	Ka=0.31 3m neg 0.210	myagent	spectral	0	-1.517684
exp1370	1.10805250e-16	1.001459	-1.000021	discard	Ka=0.31 3m neg 0.220	myagent	spectral	0	-1.517684
exp1371	2.30572529e-16	1.001459	-1.000021	discard	Ka=0.31 3m neg 0.230	myagent	spectral	0	-1.517684
exp1372	2.74590891e-16	1.001459	-1.000021	discard	Ka=0.31 3m neg 0.240	myagent	spectral	1	-1.517684
exp1373	4.91389323e-16	1.001459	-1.000021	discard	Ka=0.31 3m neg 0.250	myagent	spectral	0	-1.517684
exp1374	2.30572529e-16	1.001459	-1.000021	discard	Ka=0.31 3m neg 0.260	myagent	spectral	0	-1.517684
exp1375	2.15254883e-16	1.001459	-1.000021	discard	Ka=0.31 3m neg 0.270	myagent	spectral	1	-1.517684
exp1376	2.74590891e-16	1.001459	-1.000021	discard	Ka=0.31 3m neg 0.280	myagent	spectral	0	-1.517684
exp1377	1.10805250e-16	1.001459	-1.000021	discard	Ka=0.31 3m neg 0.290	myagent	spectral	0	-1.517684
exp1378	2.94119624e-16	1.001459	-1.000021	discard	Ka=0.31 3m neg 0.300	myagent	spectral	1	-1.517684
exp1379	2.15254883e-16	1.001459	-1.000021	discard	Ka=0.31 3m neg 0.310	myagent	spectral	0	-1.517684
exp1380	1.10805250e-16	1.001459	-1.000021	discard	Ka=0.31 3m neg 0.320	myagent	spectral	0	-1.517684
exp1381	1.10805250e-16	1.001459	-1.000021	discard	Ka=0.31 3m neg 0.330	myagent	spectral	0	-1.517684
exp1382	2.30572529e-16	1.001459	-1.000021	discard	Ka=0.31 3m neg 0.340	myagent	spectral	1	-1.517684
exp1383	1.10805250e-16	1.001459	-1.000021	discard	Ka=0.31 3m neg 0.350	myagent	spectral	0	-1.517684
exp1384	7.12670909e-16	1.001459	-1.000021	discard	Ka=0.31 3m neg 0.360	myagent	spectral	0	-1.517684
exp1385	2.30572529e-16	1.001459	-1.000021	discard	Ka=0.31 3m neg 0.370	myagent	spectral	1	-1.517684
exp1386	3.62054701e-16	1.001459	-1.000021	discard	Ka=0.31 3m neg 0.380	myagent	spectral	0	-1.517684
exp1387	2.30572529e-16	1.001459	-1.000021	discard	Ka=0.31 3m neg 0.390	myagent	spectral	0	-1.517684
exp1388	9.72957321e-16	1.140175	1.140175	discard	scipy K_frequency=0 pos	manual	initial_cond	1	-1.429425
exp1389	0.00000000e+00	0.998999	1.000000	discard	1 mode K_mode=sine, K=0 on grid	manual	spectral	1	-1.567655
exp1390	0.00000000e+00	0.998999	-1.000000	discard	1 mode sine neg	manual	spectral	0	-1.567655
