exp_id	residual	solution_norm	solution_mean	status	description	agent	design	elapsed_s	solution_energy
exp674	5.55111512e-17	1.001322	1.000049	discard	pos 1mode amp=0.01	myagent	spectral	0	-1.520921
exp675	5.62384815e-16	0.998999	1.000000	discard	scan Ka=1.5000000e-05	manual	spectral	0	-1.567655
exp676	5.55111512e-17	1.001322	1.000049	discard	pos 1mode amp=0.05	myagent	spectral	1	-1.520921
exp677	1.84688136e-16	0.998999	1.000000	discard	scan Ka=1.6000000e-05	manual	spectral	0	-1.567655
exp678	5.55111512e-17	1.001322	1.000049	discard	pos 1mode amp=0.08	myagent	spectral	0	-1.520921
exp679	1.31400151e-16	0.998999	1.000000	discard	scan Ka=1.7000000e-05	manual	spectral	0	-1.567655
exp680	5.11787527e-16	1.001322	1.000049	discard	pos 1mode amp=0.10	myagent	spectral	0	-1.520921
exp681	2.06327438e-16	0.998999	1.000000	discard	scan Ka=1.8000000e-05	manual	spectral	0	-1.567655
exp682	5.55111512e-17	1.001322	1.000049	discard	pos 1mode amp=0.12	myagent	spectral	0	-1.520921
exp683	3.69881170e-16	0.998999	1.000000	discard	scan Ka=1.9000000e-05	manual	spectral	0	-1.567655
exp684	5.55111512e-17	1.001322	1.000049	discard	pos 1mode amp=0.14	myagent	spectral	0	-1.520921
exp685	2.86134768e-16	0.998999	1.000000	discard	scan Ka=2.0000000e-05	manual	spectral	1	-1.567655
exp686	5.55111512e-17	1.001322	1.000049	discard	pos 1mode amp=0.15	myagent	spectral	1	-1.520921
exp687	5.55111512e-17	1.001322	1.000049	discard	pos 1mode amp=0.16	myagent	spectral	0	-1.520921
exp688	6.13140706e-16	1.001322	1.000049	discard	pos 1mode amp=0.17	myagent	spectral	0	-1.520921
exp689	5.55111512e-17	1.001322	1.000049	discard	pos 1mode amp=0.18	myagent	spectral	0	-1.520921
exp690	5.55111512e-17	1.001322	1.000049	discard	pos 1mode amp=0.19	myagent	spectral	1	-1.520921
exp691	5.55111512e-17	1.001322	1.000049	discard	pos 1mode amp=0.20	myagent	spectral	0	-1.520921
exp692	5.55111512e-17	1.001322	1.000049	discard	pos 1mode amp=0.25	myagent	spectral	0	-1.520921
exp693	5.71522282e-16	1.001322	1.000049	discard	pos 1mode amp=0.30	myagent	spectral	0	-1.520921
exp694	1.57009246e-16	1.001322	1.000049	discard	pos 1mode amp=0.40	myagent	spectral	1	-1.520921
exp695	1.36881710e-16	0.998999	-1.000000	discard	neg K_amp=4e-7 amp=0.1	manual	spectral	0	-1.567655
exp696	5.55111512e-17	1.001322	1.000049	discard	pos 1mode amp=0.50	myagent	spectral	0	-1.520921
exp697	3.09556221e-16	0.998999	-1.000000	discard	neg K_amp=4e-7 amp=0.04	manual	spectral	0	-1.567655
exp698	2.42985140e-16	0.998999	-1.000000	discard	neg K_amp=4e-7 amp=0.19	manual	spectral	0	-1.567655
exp699	4.55803079e-16	0.998999	-1.000000	discard	neg K_amp=4e-7 amp=0.3	manual	spectral	1	-1.567655
exp700	1.23120266e-16	0.998999	-1.000000	discard	neg K_amp=4e-7 amp=0.08	manual	spectral	0	-1.567655
exp701	3.09556221e-16	0.998999	-1.000000	discard	neg K_amp=4e-7 amp=0.09	manual	spectral	0	-1.567655
exp702	1.36881710e-16	0.998999	-1.000000	discard	neg K_amp=4e-7 amp=0.1	manual	spectral	0	-1.567655
exp703	1.23120266e-16	0.998999	-1.000000	discard	neg K_amp=4e-7 amp=0.11	manual	spectral	0	-1.567655
exp704	5.55111512e-17	1.001322	-1.000049	discard	neg 1mode amp=0.01	myagent	spectral	0	-1.520921
exp704	1.86448479e-16	1.001296	1.000019	discard	pos 4 modes amp=0.174 verify 1.86e-16	opus	spectral	0	-1.520844
exp705	2.45134363e-16	0.998999	-1.000000	discard	neg K_amp=4e-7 amp=0.12	manual	spectral	0	-1.567655
exp706	5.55111512e-17	1.001322	-1.000049	discard	neg 1mode amp=0.05	myagent	spectral	0	-1.520921
exp706	1.36881710e-16	0.998999	-1.000000	discard	neg K_amp=4e-7 amp=0.13	manual	spectral	0	-1.567655
exp707	5.55111512e-17	1.001322	-1.000049	discard	neg 1mode amp=0.08	myagent	spectral	1	-1.520921
exp708	5.55111512e-17	1.001322	-1.000049	discard	neg 1mode amp=0.10	myagent	spectral	0	-1.520921
exp709	5.55111512e-17	1.001322	-1.000049	discard	neg 1mode amp=0.12	myagent	spectral	0	-1.520921
exp710	5.55111512e-17	1.001322	-1.000049	discard	neg 1mode amp=0.15	myagent	spectral	0	-1.520921
exp711	5.55111512e-17	1.001322	-1.000049	discard	neg 1mode amp=0.16	myagent	spectral	0	-1.520921
exp712	5.55111512e-17	1.001322	-1.000049	discard	neg 1mode amp=0.18	myagent	spectral	0	-1.520921
exp713	5.55111512e-17	1.001322	-1.000049	discard	neg 1mode amp=0.20	myagent	spectral	0	-1.520921
exp714	5.11787527e-16	1.001322	-1.000049	discard	neg 1mode amp=0.25	myagent	spectral	1	-1.520921
exp715	crash	0	0	crash	K_amp=1e-8	manual	spectral	1	0
exp716	4.88688864e-16	0.998999	1.000000	discard	modes=7 Ka=1.1e-5	manual	spectral	1	-1.567655
exp717	crash	0	0	crash	K_amp=2e-8	manual	spectral	0	0
exp718	1.24874866e-16	0.998999	1.000000	discard	modes=8 Ka=1.1e-5	manual	spectral	0	-1.567655
exp719	crash	0	0	crash	K_amp=5e-8	manual	spectral	0	0
exp720	1.68166828e-16	0.998999	1.000000	discard	modes=9 Ka=1.1e-5	manual	spectral	0	-1.567655
exp721	2.04202306e-16	0.998999	1.000000	discard	K_amp=1e-7	manual	spectral	0	-1.567655
exp722	3.86442805e-16	0.998999	1.000000	discard	modes=10 Ka=1.1e-5	manual	spectral	0	-1.567655
exp723	3.86442805e-16	0.998999	1.000000	discard	K_amp=2e-7	manual	spectral	0	-1.567655
exp724	4.17187647e-16	0.998999	1.000000	discard	K_amp=3e-7	manual	spectral	1	-1.567655
exp725	1.23120266e-16	0.998999	1.000000	discard	K_amp=4e-7	manual	spectral	0	-1.567655
exp726	5.55111512e-17	1.001322	1.000049	discard	positive branch 1 mode verify	myagent	spectral	0	-1.520921
exp727	2.06774381e-16	1.001296	1.000019	discard	pos 4 modes amp=0.173	opus	spectral	0	-1.520844
exp728	8.77708367e-17	0.998999	1.000000	discard	modes=2 K_amp=4e-7	manual	spectral	0	-1.567655
exp729	5.04714136e-16	0.998999	1.000000	discard	modes=3 K_amp=4e-7	manual	spectral	1	-1.567655
exp730	1.23120266e-16	0.998999	1.000000	discard	modes=4 K_amp=4e-7	manual	spectral	0	-1.567655
exp731	crash	0	0	crash	modes=5 K_amp=4e-7	manual	spectral	0	0
exp732	6.56178450e-16	0.998999	1.000000	discard	modes=8 K_amp=4e-7	manual	spectral	0	-1.567655
exp733	0.00000000e+00	1.139035	1.140175	discard	K_frequency=0 makes K constant, pos branch exact	manual	spectral	0	-1.426566
exp734	4.37535640e-16	1.001296	1.000019	discard	pos 4 modes amp=0.175	opus	spectral	0	-1.520844
exp735	8.77708367e-17	0.998999	1.000000	discard	verify modes=2 K_amp=4e-7	manual	spectral	0	-1.567655
exp736	0.00000000e+00	1.139035	-1.140175	discard	K_frequency=0 neg branch exact	manual	spectral	1	-1.426566
exp737	8.77708367e-17	0.998999	1.000000	discard	amp=0.05	manual	spectral	0	-1.567655
exp738	2.11380166e-16	0.998999	1.000000	discard	amp=0.08	manual	spectral	0	-1.567655
exp739	8.77708367e-17	0.998999	1.000000	discard	amp=0.1	manual	spectral	1	-1.567655
exp740	8.77708367e-17	0.998999	1.000000	discard	amp=0.12	manual	spectral	0	-1.567655
exp741	8.77708367e-17	0.998999	1.000000	discard	amp=0.15	manual	spectral	0	-1.567655
exp742	8.77708367e-17	0.998999	1.000000	discard	amp=0.19	manual	spectral	0	-1.567655
exp743	8.77708367e-17	0.998999	1.000000	discard	K_amp=1e-7 modes=2	manual	spectral	0	-1.567655
exp744	5.55111512e-17	0.998999	1.000000	discard	K_amp=2e-7 modes=2	manual	spectral	0	-1.567655
exp745	8.77708367e-17	0.998999	1.000000	discard	K_amp=3e-7 modes=2	manual	spectral	0	-1.567655
exp746	8.77708367e-17	0.998999	1.000000	discard	K_amp=4e-7 modes=2	manual	spectral	1	-1.567655
exp747	8.77708367e-17	0.998999	1.000000	discard	K_amp=5e-7 modes=2	manual	spectral	0	-1.567655
exp748	8.77708367e-17	0.998999	1.000000	discard	K_amp=6e-7 modes=2	manual	spectral	0	-1.567655
exp749	0.00000000e+00	0.998999	1.000000	discard	K_amp=7e-7 modes=2	manual	spectral	0	-1.567655
exp750	8.77708367e-17	0.998999	1.000000	discard	K_amp=8e-7 modes=2	manual	spectral	1	-1.567655
exp751	1.24126708e-16	0.998999	1.000000	discard	K_amp=9e-7 modes=2	manual	spectral	0	-1.567655
exp752	1.24126708e-16	0.998999	1.000000	discard	K_amp=1e-6 modes=2	manual	spectral	0	-1.567655
exp753	2.04903081e-16	1.001296	1.000019	discard	pos 4m amp=0.1742	opus	spectral	1	-1.520844
exp754	1.96261557e-16	1.001296	1.000019	discard	pos 4m amp=0.1738	opus	spectral	0	-1.520844
exp755	3.62021453e-16	1.001296	1.000019	discard	pos 4m amp=0.1735	opus	spectral	0	-1.520844
exp756	1.86448479e-16	1.001296	1.000019	discard	pos 4m amp=0.1745	opus	spectral	0	-1.520844
exp757	0.00000000e+00	0.998999	1.000000	discard	verify modes=2 K_amp=7e-7	manual	spectral	0	-1.567655
exp757	5.55111512e-17	1.001322	1.000049	discard	pos 1mode offset=0.9	myagent	spectral	0	-1.520921
exp758	5.55111512e-17	1.001322	1.000049	discard	pos 1mode offset=0.95	myagent	spectral	0	-1.520921
exp759	5.55111512e-17	1.001322	1.000049	discard	pos 1mode offset=0.99	myagent	spectral	0	-1.520921
exp760	5.55111512e-17	1.001322	1.000049	discard	pos 1mode offset=1.0	myagent	spectral	1	-1.520921
exp761	5.55111512e-17	1.001322	1.000049	discard	verify 1 mode amp=0.15 from session 3	manual	spectral	0	-1.520921
exp762	5.55111512e-17	1.001322	1.000049	discard	pos 1mode offset=1.001	myagent	spectral	0	-1.520921
exp763	5.55111512e-17	1.001322	1.000049	discard	pos 1mode offset=1.01	myagent	spectral	0	-1.520921
exp764	7.06541606e-16	1.001322	1.000049	discard	pos 1mode offset=1.05	myagent	spectral	0	-1.520921
exp765	5.55111512e-17	1.001322	1.000049	discard	pos 1mode offset=1.1	myagent	spectral	1	-1.520921
exp766	0.00000000e+00	0.998999	-1.000000	discard	neg modes=2 K_amp=7e-7	manual	spectral	0	-1.567655
exp767	4.46791494e-16	0.999728	1.000002	discard	pos 4m amp=0.1746	opus	spectral	0	-1.551758
exp768	0.00000000e+00	0.998999	1.000000	discard	1 mode Ka=0	manual	spectral	1	-1.567655
exp769	5.45111838e-16	0.999729	1.000002	discard	pos 4m amp=0.1747	opus	spectral	0	-1.551740
exp770	2.98936698e-16	0.998999	1.000000	discard	1 mode Ka=1.1e-5	manual	spectral	0	-1.567655
exp771	5.41144757e-16	0.999730	1.000002	discard	pos 4m amp=0.1748	opus	spectral	0	-1.551722
exp772	1.24126708e-16	0.998999	1.000000	discard	1 mode Ka=1e-5	manual	spectral	0	-1.567655
exp773	4.86737565e-16	0.999731	1.000002	discard	pos 4m amp=0.1749	opus	spectral	0	-1.551703
exp774	2.35513869e-16	0.998999	1.000000	discard	1 mode Ka=1e-6	manual	spectral	0	-1.567655
exp775	8.28551585e-16	0.999731	1.000002	discard	pos 4m amp=0.1750	opus	spectral	0	-1.551685
exp776	1.24126708e-16	0.998999	1.000000	discard	1 mode Ka=1e-4	manual	spectral	1	-1.567655
exp777	6.87493478e-16	0.999732	1.000002	discard	pos 4m amp=0.1751	opus	spectral	1	-1.551667
exp778	crash	0	0	crash	pos 4m amp=0.1752	opus	spectral	0	0
exp779	5.34520072e-16	0.999736	1.000002	discard	pos 4m amp=0.1755	opus	spectral	0	-1.551594
exp780	7.84616790e-16	0.999740	1.000002	discard	pos 4m amp=0.1760	opus	spectral	0	-1.551502
exp781	5.97087688e-16	0.999722	1.000002	discard	pos 4m amp=0.17400	opus	spectral	0	-1.551867
exp782	4.93027822e-16	0.999723	1.000002	discard	pos 4m amp=0.17405	opus	spectral	0	-1.551858
exp783	3.01861824e-16	0.999723	1.000002	discard	pos 4m amp=0.17410	opus	spectral	1	-1.551849
exp784	crash	0	0	crash	pos 4m amp=0.17415	opus	spectral	0	0
exp785	2.48253415e-16	1.000579	1.000024	discard	1 mode Ka=0.25	manual	spectral	0	-1.535146
exp786	6.02046523e-16	0.999724	1.000002	discard	pos 4m amp=0.17420	opus	spectral	0	-1.551831
exp787	7.85046229e-17	1.000858	1.000032	discard	1 mode Ka=0.27	manual	spectral	0	-1.529761
exp788	7.94192708e-16	0.999725	1.000002	discard	pos 4m amp=0.17425	opus	spectral	0	-1.551822
exp789	7.85046229e-17	1.001007	1.000037	discard	1 mode Ka=0.28	manual	spectral	0	-1.526916
exp790	6.31172408e-16	0.999725	1.000002	discard	pos 4m amp=0.17430	opus	spectral	1	-1.551812
exp791	2.00148302e-16	1.001162	1.000043	discard	1 mode Ka=0.29	manual	spectral	0	-1.523969
exp792	6.69953710e-16	0.999726	1.000002	discard	pos 4m amp=0.17435	opus	spectral	0	-1.551803
exp793	5.55111512e-17	1.001322	1.000049	discard	1 mode Ka=0.30	manual	spectral	0	-1.520921
exp794	crash	0	0	crash	pos 4m amp=0.17440	opus	spectral	0	0
exp795	0.00000000e+00	1.001489	1.000056	discard	1 mode Ka=0.31	manual	spectral	0	-1.517772
exp796	crash	0	0	crash	pos 4m amp=0.17445	opus	spectral	0	0
exp797	5.55111512e-17	1.001661	1.000064	discard	1 mode Ka=0.32	manual	spectral	0	-1.514522
exp798	crash	0	0	crash	pos 4m amp=0.17450	opus	spectral	0	0
exp799	2.48253415e-16	1.001840	1.000072	discard	1 mode Ka=0.33	manual	spectral	1	-1.511171
exp800	2.77555756e-16	1.002214	1.000091	discard	1 mode Ka=0.35	manual	spectral	0	-1.504169
exp801	0.00000000e+00	1.001489	1.000056	discard	verify 1 mode Ka=0.31	manual	spectral	1	-1.517772
exp802	0.00000000e+00	1.001489	1.000056	discard	verify 1 mode Ka=0.31	manual	spectral	0	-1.517772
exp803	0.00000000e+00	1.001489	1.000056	discard	verify 1 mode Ka=0.31	manual	spectral	0	-1.517772
exp804	0.00000000e+00	0.998999	1.000000	discard	modes=1 K_amp=7e-7	manual	spectral	0	-1.567655
exp805	5.97087688e-16	0.999722	1.000002	discard	pos 4m amp=0.174 verify	opus	spectral	0	-1.551867
exp806	0.00000000e+00	0.998999	1.000000	discard	1mode Ka=1e-20	myagent	spectral	0	-1.567655
exp807	0.00000000e+00	1.001489	-1.000056	discard	1 mode Ka=0.31 negative	manual	spectral	0	-1.517772
exp808	0.00000000e+00	0.998999	1.000000	discard	1mode Ka=1e-18	myagent	spectral	0	-1.567655
exp809	1.24126708e-16	0.998999	1.000000	discard	1mode Ka=1e-16	myagent	spectral	0	-1.567655
exp810	2.00148302e-16	0.998999	1.000000	discard	1mode Ka=1e-14	myagent	spectral	1	-1.567655
exp811	2.35513869e-16	0.998999	1.000000	discard	1mode Ka=1e-12	myagent	spectral	0	-1.567655
exp812	2.00148302e-16	0.998999	1.000000	discard	1mode Ka=1e-10	myagent	spectral	0	-1.567655
exp813	1.75541673e-16	0.998999	1.000000	discard	1mode Ka=1e-8	myagent	spectral	0	-1.567655
exp814	2.35513869e-16	0.998999	1.000000	discard	1mode Ka=1e-6	myagent	spectral	1	-1.567655
exp815	1.24126708e-16	0.998999	1.000000	discard	1mode Ka=1e-4	myagent	spectral	0	-1.567655
exp816	1.24126708e-16	0.998996	1.000000	discard	1mode Ka=0.01	myagent	spectral	0	-1.567603
exp817	3.72380123e-16	0.999210	1.000001	discard	1mode Ka=0.1	myagent	spectral	0	-1.562436
exp818	5.55111512e-17	1.001322	1.000049	discard	1mode Ka=0.3	myagent	spectral	1	-1.520921
exp819	5.55111512e-17	1.001322	1.000049	discard	verify modes=1 K_amp=0.3	manual	spectral	0	-1.520921
exp820	5.55111512e-17	1.001322	1.000049	discard	scan	manual	spectral	0	-1.520921
exp821	5.55111512e-17	1.001405	1.000053	discard	scan	manual	spectral	1	-1.519359
exp822	1.57009246e-16	1.001455	1.000055	discard	scan	manual	spectral	0	-1.518410
exp823	1.24126708e-16	1.001472	1.000055	discard	scan	manual	spectral	0	-1.518091
exp824	0.00000000e+00	1.001489	1.000056	discard	scan	manual	spectral	0	-1.517772
exp825	1.24126708e-16	1.001506	1.000057	discard	scan	manual	spectral	1	-1.517451
exp826	3.55444798e-16	1.001523	1.000058	discard	scan	manual	spectral	0	-1.517130
exp827	3.14018492e-16	1.001540	1.000058	discard	scan	manual	spectral	0	-1.516807
exp828	2.00148302e-16	1.001574	1.000060	discard	scan	manual	spectral	0	-1.516159
exp829	5.55111512e-17	1.001661	1.000064	discard	scan	manual	spectral	1	-1.514522
exp830	0.00000000e+00	0.998999	1.000000	discard	1mode Ka=7e-7	myagent	spectral	0	-1.567655
exp831	7.85046229e-17	0.999980	1.000010	discard	modes=1 K_amp=0.20	manual	spectral	0	-1.546820
exp832	1.66533454e-16	1.000202	1.000014	discard	modes=1 K_amp=0.22	manual	spectral	0	-1.542458
exp833	4.74287484e-16	1.000447	1.000020	discard	modes=1 K_amp=0.24	manual	spectral	1	-1.537686
exp834	2.77555756e-16	1.000716	1.000028	discard	modes=1 K_amp=0.26	manual	spectral	0	-1.532505
exp835	7.85046229e-17	1.001007	1.000037	discard	modes=1 K_amp=0.28	manual	spectral	0	-1.526916
exp836	5.55111512e-17	1.001322	1.000049	discard	modes=1 K_amp=0.30	manual	spectral	0	-1.520921
exp837	2.00148302e-16	1.001480	1.000056	discard	modes=1 K_amp=0.32	manual	spectral	1	-1.517932
exp838	2.00148302e-16	1.001480	1.000056	discard	scan2	manual	spectral	0	-1.517932
exp839	7.85046229e-17	1.001485	1.000056	discard	scan2	manual	spectral	0	-1.517836
exp840	5.55111512e-17	1.001487	1.000056	discard	scan2	manual	spectral	0	-1.517804
exp841	0.00000000e+00	1.001489	1.000056	discard	scan2	manual	spectral	0	-1.517772
exp842	0.00000000e+00	1.001489	1.000056	discard	scan2	manual	spectral	0	-1.517772
exp843	7.85046229e-17	1.001491	1.000056	discard	scan2	manual	spectral	0	-1.517740
exp844	2.22044605e-16	1.001492	1.000056	discard	scan2	manual	spectral	0	-1.517708
exp845	7.85046229e-17	1.001497	1.000057	discard	scan2	manual	spectral	1	-1.517612
exp846	2.00148302e-16	0.998999	1.000000	discard	modes=1 K_amp=0.001	manual	spectral	0	-1.567654
exp847	2.48253415e-16	0.998997	1.000000	discard	modes=1 K_amp=0.005	manual	spectral	1	-1.567642
exp848	1.24126708e-16	0.998996	1.000000	discard	modes=1 K_amp=0.01	manual	spectral	0	-1.567603
exp849	0.00000000e+00	0.998999	1.000000	discard	boundary Ka=1e-19 1mode	myagent	spectral	0	-1.567655
exp850	1.24126708e-16	0.998997	1.000000	discard	modes=1 K_amp=0.02	manual	spectral	0	-1.567446
exp851	0.00000000e+00	0.998999	1.000000	discard	boundary Ka=5e-19 1mode	myagent	spectral	0	-1.567655
exp852	1.24126708e-16	0.999035	1.000000	discard	modes=1 K_amp=0.05	manual	spectral	0	-1.566349
exp853	0.00000000e+00	0.998999	1.000000	discard	boundary Ka=1e-18 1mode	myagent	spectral	0	-1.567655
exp854	3.72380123e-16	0.999210	1.000001	discard	modes=1 K_amp=0.1	manual	spectral	1	-1.562436
exp855	0.00000000e+00	0.998999	1.000000	discard	boundary Ka=5e-18 1mode	myagent	spectral	0	-1.567655
exp856	1.24126708e-16	0.999525	1.000003	discard	modes=1 K_amp=0.15	manual	spectral	0	-1.555923
exp857	0.00000000e+00	0.998999	1.000000	discard	boundary Ka=1e-17 1mode	myagent	spectral	0	-1.567655
exp858	0.00000000e+00	0.998999	1.000000	discard	boundary Ka=5e-17 1mode	myagent	spectral	0	-1.567655
exp859	1.24126708e-16	0.998999	1.000000	discard	boundary Ka=1e-16 1mode	myagent	spectral	0	-1.567655
exp860	1.75541673e-16	0.998999	1.000000	discard	boundary Ka=5e-16 1mode	myagent	spectral	0	-1.567655
exp861	1.24126708e-16	0.998996	1.000000	discard	Ka scan	manual	spectral	1	-1.567603
exp862	1.24126708e-16	0.998997	1.000000	discard	Ka scan	manual	spectral	0	-1.567446
exp863	1.75541673e-16	0.999004	1.000000	discard	Ka scan	manual	spectral	0	-1.567185
exp864	2.00148302e-16	0.999017	1.000000	discard	Ka scan	manual	spectral	0	-1.566819
exp865	1.24126708e-16	0.999035	1.000000	discard	Ka scan	manual	spectral	1	-1.566349
exp866	1.75541673e-16	0.999059	1.000000	discard	Ka scan	manual	spectral	0	-1.565775
exp867	2.35513869e-16	0.999089	1.000000	discard	Ka scan	manual	spectral	0	-1.565097
exp868	1.57009246e-16	0.999124	1.000000	discard	Ka scan	manual	spectral	0	-1.564314
exp869	2.98936698e-16	0.999164	1.000000	discard	Ka scan	manual	spectral	1	-1.563427
exp870	3.72380123e-16	0.999210	1.000001	discard	Ka scan	manual	spectral	0	-1.562436
exp871	3.23682852e-16	0.999262	1.000001	discard	Ka scan	manual	spectral	0	-1.561341
exp872	3.72380123e-16	0.999319	1.000001	discard	Ka scan	manual	spectral	0	-1.560142
exp873	4.00296604e-16	0.999382	1.000002	discard	Ka scan	manual	spectral	1	-1.558839
exp874	7.85046229e-17	0.999450	1.000002	discard	Ka scan	manual	spectral	0	-1.557433
exp875	2.00148302e-16	1.001162	1.000043	discard	Ka scan	manual	spectral	0	-1.523969
exp876	2.00148302e-16	0.999604	1.000004	discard	modes=1 K_amp=0.29	manual	spectral	0	-1.554309
exp877	1.11022302e-16	1.001241	1.000046	discard	Ka scan	manual	spectral	0	-1.522458
exp878	2.00148302e-16	0.999690	1.000005	discard	modes=1 K_amp=0.295	manual	spectral	0	-1.552592
exp879	5.55111512e-17	1.001322	1.000049	discard	Ka scan	manual	spectral	0	-1.520921
exp880	2.77555756e-16	0.999781	1.000006	discard	modes=1 K_amp=0.30	manual	spectral	1	-1.550771
exp881	5.55111512e-17	1.001405	1.000053	discard	Ka scan	manual	spectral	1	-1.519359
exp882	1.75541673e-16	0.999878	1.000008	discard	modes=1 K_amp=0.305	manual	spectral	0	-1.548847
exp883	0.00000000e+00	1.001489	1.000056	discard	Ka scan	manual	spectral	0	-1.517772
exp884	7.85046229e-17	0.999980	1.000010	discard	modes=1 K_amp=0.31	manual	spectral	0	-1.546820
exp885	7.85046229e-17	0.999980	1.000010	discard	Ka scan	manual	spectral	0	-1.546820
exp886	7.85046229e-17	1.000088	1.000012	discard	Ka scan	manual	spectral	0	-1.544691
exp887	1.66533454e-16	1.000202	1.000014	discard	Ka scan	manual	spectral	1	-1.542458
exp888	7.94798730e-16	1.000322	1.000017	discard	Ka scan	manual	spectral	0	-1.540123
exp889	4.74287484e-16	1.000447	1.000020	discard	Ka scan	manual	spectral	0	-1.537686
exp890	2.48253415e-16	1.000579	1.000024	discard	Ka scan	manual	spectral	0	-1.535146
exp891	2.77555756e-16	1.000716	1.000028	discard	Ka scan	manual	spectral	1	-1.532505
exp892	7.85046229e-17	1.000858	1.000032	discard	Ka scan	manual	spectral	0	-1.529761
exp893	7.85046229e-17	1.001007	1.000037	discard	Ka scan	manual	spectral	0	-1.526916
exp894	2.00148302e-16	1.001162	1.000043	discard	Ka scan	manual	spectral	0	-1.523969
exp895	5.55111512e-17	1.001322	1.000049	discard	Ka scan	manual	spectral	1	-1.520921
exp896	0.00000000e+00	1.001489	1.000056	discard	Ka scan	manual	spectral	0	-1.517772
exp897	5.55111512e-17	1.001661	1.000064	discard	Ka scan	manual	spectral	0	-1.514522
exp898	2.48253415e-16	1.001840	1.000072	discard	Ka scan	manual	spectral	0	-1.511171
exp899	2.48253415e-16	1.002024	1.000081	discard	Ka scan	manual	spectral	1	-1.507721
exp900	2.77555756e-16	1.002214	1.000091	discard	Ka scan	manual	spectral	0	-1.504169
exp900	5.55111512e-17	1.001322	1.000049	discard	cosine freq=1 1mode	myagent	spectral	0	-1.520921
exp901	0.00000000e+00	1.139035	1.140175	discard	cosine freq=2 1mode	myagent	spectral	0	-1.426566
exp901	1.75541673e-16	1.002411	1.000102	discard	Ka scan	manual	spectral	0	-1.500519
exp902	7.85046229e-17	1.002613	1.000113	discard	Ka scan	manual	spectral	0	-1.496768
exp902	5.55111512e-17	1.001322	1.000049	discard	cosine freq=3 1mode	myagent	spectral	0	-1.520921
exp903	2.77555756e-16	1.002822	1.000126	discard	Ka scan	manual	spectral	1	-1.492918
exp903	0.00000000e+00	0.998999	1.000000	discard	sine freq=1 1mode	myagent	spectral	1	-1.567655
exp904	1.75541673e-16	1.003037	1.000140	discard	Ka scan	manual	spectral	0	-1.488969
exp904	1.24126708e-16	0.998999	1.000000	discard	sine freq=2 1mode	myagent	spectral	0	-1.567655
exp905	2.35513869e-16	1.003257	1.000154	discard	Ka scan	manual	spectral	0	-1.484921
